0,,hylabel,yz_label,agreed,num_singlish,num_singlish_yz,num_particles_match
"[{'role': 'user', 'content': '\nA: Ya but then yet, there are many churches that allow us to book, but they only allow us to book three months in advance.\n\nB: Uhm.\n\nA: You know, all the confusion.\n\nB: So, you have to make your list lah, which one allows you to book, which one can convey the order.\n\nA: And now, with the phone rates.\n\nB: You have to spend a lot of money on it, so you try.\n\nA: So I try to call as many as possible last week.'}]","A: There are many churches that allow us to book, but some only allow us to book three months in advance. That is so confusing!
B: So, you have to make your list lah, which one allows you to book, which one can convey the order.","[""lah51""]",['lah51'],TRUE,2,1,FALSE
"[{'role': 'user', 'content': '\nB: Just for that afternoon.\n\nA: Ya, and then uhm we wrote in, but already taken up. That day we wanted, they said still available, you know. So by that time, we wrote in our letter. Two weeks later already taken up.\n\nA: Maybe it\'s also good that it\'s been taken up, so quite expensive leh - uh, nine hundred dollars. But on average, about four hundred to five hundred dollars both lah - the reception and the sanctuary.\n\nB: How much have you to pay?\n\nA: Four hundred as a church member is it?\n\nB: Are you a church member?'}]","
B: Just for that afternoon?

A: Ya, and then we wrote in, but already taken up. That day we wanted, they said still available, you know. So by that time, we wrote in our letter. Two weeks later already taken up.

A: Maybe it\'s also good that it\'s been taken up, so quite expensive leh, nine hundred dollars. But on average, about four hundred to five hundred dollars both lah - the reception and the sanctuary.

","[""leh33"", ""lah21""]","[""leh33"", ""lah21""]",TRUE,3,2,FALSE
"[{'role': 'user', 'content': '\nA: Where\'s the West?\nB: Near to the camp. Or you know, if you\'re facing there, there\'s a road. Right, Chua Chu Kang way.\nA: Ya, facing Chua Chu Kang Way.\nB: I think that\'s the West. Not exactly West lah, probably slanted.\nA: Can\'t see sunset ah?\nB: Ya, probably you\'ll see sunset but only from the third floor.'}]","

A: Where's Clementi? Is it in the west?
B: I think that\'s in the West. Or maybe not exactly West lah, but around there.
","[""lah21""]","[""lah21""]",TRUE,2,1,FALSE
"[{'role': 'user', 'content': '\nB: Up towards, uh, my side.\nA: Up hah.\nA: Then the three sides, all flats.\nB: The other side lah.\nA: No, no, uhm... my the other side is like, a multi-storey car-park.'}]","
B: You got lost? okay tell me your surroundings.
A: On my right is like a mall
B: The other side leh?
A: My other side is like, a multi-storey car-park.","[""leh33""]","[""leh33""]",,2,1,FALSE
"[{'role': 'user', 'content': '\nA: Then we spend what, huh? Five hours traveling and waiting.\nA: I left my house at one, met in school at two.\nA: Supposed to meet at two.\nA: Then some students came late, you know? Came about two plus almost three. So we left West coast lah, at three.\nA: Then we traveled, uh, okay. We waited for a long time for Fifty-One. After that, took the train. Then up till Eunos.\nA: Uh, the train broke down.\nB: Aiyoh.'}]","
A: Then we spend around five hours traveling and waiting. I left my house at one, met in school at two. Supposed to meet at two. Then some students came late, you know? Came about two plus almost three. So we left West coast lah, at three.
A: Uh, the train broke down.
B: Aiyoh, what terrible luck.","[""lah51""]","[""lah51""]",,2,1,FALSE
"[{'role': 'user', 'content': '\nB: How come you all go all the way to Pasir Ris, where you could have gone West Coast?\n\nA: Ya lor, because... ya, they couldn\'t get fully booked at west coast, so they could get it but Pasir Ris not bad leh. Their new park just beside NTUC quite nice quite nice. Then the sea part is quite ah, the beach is quite broad also ah. Different from west coast because west coast is very crowded what.'}]","
B: How come you all go all the way to Pasir Ris, where you could have gone West Coast?

A: Ya lor, because... ya, they couldn\'t get fully booked at west coast, so they could get it but Pasir Ris not bad leh. Their new park just beside NTUC quite nice. Then the beach is quite broad also. Different from west coast because west coast is very crowded what.","[""lor33"", ""leh21""]","[""lor33"", ""leh21""]",,2,2,TRUE
"[{'role': 'user', 'content': '\nA: Then the sea part is quite broad, the beach is quite spacious also. Different from West Coast, \'cos West Coast is very crowded, right? All the ships and all that over there are very clear, so it\'s good. Ya lah, so that day was the last time. I won\'t be going down anymore for their practices.\n\nB: The other teacher has taken over.\n\nA: She has taken over since she joined in July. But she\'s away now in the States. So we just leave it to them on their own to carry out whatever practices lah.'}]","
A: Then the sea part is quite broad, the beach is quite spacious also. Different from West Coast, \'cos West Coast is very crowded, right? All the ships and all that over there are very clear, so it\'s good. Ya lah, so that day was the last time. I won\'t be going down anymore for their practices.

B: The other teacher has taken over.

A: She has taken over since she joined in July. But she\'s away now in the States. So we just leave it to them on their own to carry out whatever practices lah.","[ ""lah51"", ""lah21""]","[""lah21"", ""lah21""]",,3,2,FALSE
"[{'role': 'user', 'content': '\nB: We\'ll just show them how to use a catalogue, show them all our library. Bring them to the different departments, tell them what to do and all that.\n\nA: You know most of the lecturers?\n\nA: Not almost. It depends on the department. Like some new, some new lecturers and all that lah. When it comes, then...\n\nA: And then make an appointment with them. Then I know them by face.\n\nA: And all that. Others is like, based on what I know, is as an undergrad. Then I\'m supposed to do, uh, estate management, architecture.'}]","
A: You know most of the lecturers at the university?

A: Not really. It depends on the department. Also, some lecturers are quite new lah. Maybe I would not have a chance to bump into them
","[""lah21""]","[""lah21""]",,2,1,FALSE
"[{'role': 'user', 'content': '\nB: Ah, hah!\nB: Oh.\nA: I just took a break lah.\nA: Had to go back to my work just now.\nB: How many classes do you have to mark?\nA: Three.'}]","
B: Ah, hah! So you were slacking all day, is it?
A: I just took a break lah. Had to go back to my work just now.
","[""lah21""]","[""lah24""]",,2,1,FALSE
"[{'role': 'user', 'content': '\nB: Oh.\nA: You know what I mean because I would have marked the paper I am going to get on Tuesday. It\'s not too difficult to mark.\nB: Who does the scheduling?\nA: The head of department (HOD) lah.\nB: Ah, okay.\nA: Ya, but I don\'t know. I\'ll see if I can\'t cope. If so, I might tell her. Then maybe, second next term, they can do something about it lah.\nA: Ya.'}]","
B: Oh.
A: You know what I mean because I would have marked the paper I am going to get on Tuesday. It\'s not too difficult to mark.
B: Who does the scheduling?
A: The head of department (HOD) lah.
B: Ah, okay.
A: Ya, but I don\'t know. I\'ll see if I can\'t cope. If so, I might tell her. Then maybe, second next term, they can do something about it lah.
A: Ya.","[""lah51"", ""lah21""]","[""lah51"", ""lah21""]",,3,2,FALSE
"[{'role': 'user', 'content': '\nB: Eh, very lucky cat.\nB: Don\'t need to worry, we want to go already.\n\nA: Aiyoh, ya lah, your cats are so lucky lah...\nB: Hah.\nA: The animals who live in your house, they really very lucky one.'}]","
B: What a cute cat! Don\'t need to worry, we want to go already and we won\'t bother your cat anymore.
A: Ya lor, your cats are so lucky leh...
B: Hah, thank you very much.
A: The animals who live in your house, they really very lucky one.","[""lor33"", ""leh21""]","[""lor33"", ""leh21""]",,2,1,FALSE
"[{'role': 'user', 'content': '\nB: Eh, you know, then he became rich... (unclear word)\nA: Ya lor, got many people like that.\nA: Like from rags to riches kind of story.\nB: No lah, Carol. Not so many.\nA: Quite a lot leh, I mean.\nB: I mean, got.\nA: Just that we don\'t know, especially those from China and all that.'}]","
B: Eh, you know, then he became rich...
A: Ya lor, got many people like that, like from rags to riches kind of story.
B: No lah, Carol. Not so many.
A: Quite a lot leh, I mean.
B: I mean, got a few, Just that we don\'t know, especially those from China and all that.","[""lor33"", ""lah21"", ""leh21""]","[""lor33"", ""lah51"", ""leh33""]",,4,3,FALSE
"[{'role': 'user', 'content': '\nB: Most of the collies that came here, well, maybe they became middle class over generations but they didn\'t become rich overnight.\n\nA: Not overnight lah, of course not overnight. They worked very hard.\n\nB: They, as individuals, did not...'}]","
B: Most of the collies that came here, well, maybe they became middle class over generations but they didn\'t become rich overnight.

A: Not overnight lah, of course not overnight. They worked very hard.

","[""lah51""]","[""lah51""]",,2,1,FALSE
"[{'role': 'user', 'content': '\nB: Not possible either.\nB: Whatever lah.\n\nA: Ya lor.\nA: I suppose you mean you can hold to your own beliefs is it?\n\nB: But it\'s just like God. I mean, sometimes you man, I mean, ""Oh"", did you read the latest Reader\'s Digest?\n\nA: Oh on what?\n\nB: Steven Hawking.'}]","
B: Not possible to convince him, whatever lah, I give up.

A: Ya lor, he is a lost cause.

","[""lah21"", ""lor33""]","[""lah21"", ""lor33""]",,3,2,FALSE
"[{'role': 'user', 'content': '\nA: Ya, it is the movie that you cannot tell me the ending, right?\nA: You are not supposed to tell me.\nA: Ya, it will be kind to me if you let me watch it first.\nA: I have to see it eventually lah.\nB: You have to see it yourself.\nA: Ya, the thing is that I don\'t know which theatre it\'s showing at though.\nA: It\'s kind of obscure places.'}]","

A: Please don't spoil the movie for me lah. it will be kind to me if you let me watch it first.
","[""lah24""]","[""lah24""]",,3,1,FALSE
"[{'role': 'user', 'content': '\nB: You have to see it, lah.\nA: Ya, the thing is that I don\'t know which theatres though.\nA: It\'s kind of obscure places.\nB: No lah.\nB: There are all sorts of interesting twists to it.\nA: Uhm.\nB: You know, it is like it is very British.'}]","
A: I heard a new James Bond movie just got released.
B: It is such a good movie, you have to see it lah.
","[""lah24""]","[""lah24""]",,3,2,FALSE
"[{'role': 'user', 'content': '\nA: Eh, aiyoh, my friend went to see it already, he said it was very good leh.\nA: You know you said it was very good, right?\nB: Uh huh.\nA: Yah lah, must go see it!\nB: I think got two months plus, only can watch the movie here, after America already watch it.\nB: Uhm.'}]","
A: Eh, aiyoh, my friend went to see the James Bond movie already, he said it was very good leh.
A: You know you said it was very good, right?
B: Uh huh.
A: Yah lah, must go see it!
","[""leh21"", ""lah51""]","[""leh21"", ""lah51""]",,3,2,FALSE
"[{'role': 'user', 'content': '\nD: Eh...\nA: Are you still reading that one?\nB: No, I just need the acting one.\nA: You should read the other one lah.\nB: Eh...\nA:Although I\'m sure you must have read it already.'}]","

A: Are you still reading that book?
B: No, I finished it. I am thinking of reading another one.
A: You should read the book I recommended to you lah.
","[""lah24""]","[""lah24""]",,3,1,FALSE
"[{'role': 'user', 'content': '\nC: Eh, for me also, I work in the library because I have to conduct course visits, right?\nB: Ah.\nC: For the students, I mean when they come, some of them are from, uh, very bad schools lah. From quite lousy schools, okay?\nB: Uhm, uhm.\nC: So when I talk to them, if I want to make myself understood, let\'s say to the lower primary students in Primary 2 or Primary 4, and they\'re from, these courses, I will have to...'}]","
C: I do my work work in the school library because I am a visiting lecturer.
B: Ah I see...
C: For the students, I mean when they come, some of them are from very good schools lah.
","[""lah21""]","[""lah21""]",,2,1,FALSE
"[{'role': 'user', 'content': '\nA: Eh, I have to speak business English with the bankers?\nC: Ya, I think so.\nB: Proper English.\nA: Be more professional lah, you know.\nC: I think Peck See probably won\'t have that kind of problem lah.'}]","
A: Eh, I have to speak business English with the bankers?
C: Ya, I think so.
B: Proper English.
A: Be more professional lah, you know.
C: I think Peck See probably won\'t have that kind of problem lah.","[""lah21"", ""lah21""]","[""lah21"", ""lah24""]",,3,2,FALSE
"[{'role': 'user', 'content': '\nB: ""Eh, I really hate people who slang. Wah, I cannot stand it and I also cannot understand leh. That\'s the worst part.""\n\nC: ""Ya lor. Then, \'A\', we\'re talking about the tour, is it? How ah?""'}]","
B: ""Eh, I really hate people who slang. Wah, I cannot stand it and I also cannot understand leh. That\'s the worst part.""

C: ""Ya lor. Then, \'A\', we\'re talking about the tour, is it? How ah?""","[""leh33"", ""lor33""]","[""leh33"", ""lor33""]",,3,2,FALSE
"[{'role': 'user', 'content': '\nB: It\'s only thirty dollars leh. Other tour agencies charge fifty to sixty dollars.\nC: Four-star hotel is it?\nB: Uhm, I think so, around there.\nB: That\'s why I\'m not sure, up to you'}]","
B: It\'s only thirty dollars leh. Other tour agencies charge fifty to sixty dollars.
C: Four-star hotel is it?
B: Uhm, I think so, around there.
","[""leh21""]","[""leh21""]",,2,1,FALSE
"[{'role': 'user', 'content': '\nB: ""Eh, you see this is four seven nine.""\n\nA: ""But when you go there, you have to buy things what.""\n\nB: ""Okay, plus. Eh, provided you don\'t buy things lor.""\n\nC: ""Wait wait wait.""\n\nC: ""You said it\'s four seven nine for three days ah?""\n\nB: ""Ah, four seven nine then plus twelve dollars airport tax.""'}]","

A: What do I do if my professor does not want to compromise?
B: Liddat lor, just suck thumb. There is nothing you can do about it.
","[""lor33""]","[""lor33""]",,2,1,FALSE
"[{'role': 'user', 'content': '\nB: ""Eh, four seven nine then plus twelve dollars airport tax lah.""\nA: ""Ya.""\nB: ""Ya.""\nC: ""But then the food leh? Do they cover all meals or not?""\nB: ""They covered all meals except for the third day, only breakfast. So you settle your own dinner and lunch.""'}]","
B: How good are the accomodations?
A: Not bad lah, not bad.
B: Then the food leh?
","[""lah21"", ""leh33""]","[""lah21"", ""leh33""]",,4,3,FALSE
"[{'role': 'user', 'content': '\nB: Eh, inside the tour there\'s no such lunch. If you want to go, you have to go on your own.\nC: So, what else can we do? \nB: Caves lah.'}]","


C: So, what do we do during the tour? 
B: Explore the caves lah.","[""lah51""]","[""lah51""]",,5,1,FALSE
"[{'role': 'user', 'content': '\nC: Actually, mostly it\'s going there to shop lor.\nB: Ah lah!'}]","
B: What will we do in Venice?
C: Mostly it\'s going there to shop lor.
","[""lor33""]","[""lor33""]",,5,2,FALSE
"[{'role': 'user', 'content': '\nB: Ya, I heard it\'s because they have to import the goods directly from Bangkok itself.\nA: They are selling imported goods, is it?\nC: So, actually, Bangkok is cheaper lah.\nA: Ya.\nB: Bangkok itself is very cheap. I tell you, if you ask Ee Lan about that, she will tell you about it vigorously.'}]","
B: Ya, I heard it\'s because they have to import the goods directly from Bangkok itself.
A: They are selling imported goods, is it?
C: So, actually, Bangkok is cheaper lah.
A: Ya, Bangkok goods are very cheap. ","[""lah51""]",,,2,1,FALSE
"[{'role': 'user', 'content': '\nC: Really?\nC: Cheap in terms of what?\nB: Ya lah, things are very cheap.\nB: She bought so much for Christmas last year.\nC: Ha.'}]","
C: Really?
C: Cheap in terms of what?
B: Ya lah, things are very cheap.
B: She bought so much for Christmas last year.
C: Ha.","[""lah51""]",,,2,1,FALSE
"[{'role': 'user', 'content': '\nC: Wanna go Bangkok?\nC: I\'m...\n\nB: But you know, one thing about Bangkok is that it\'s very congested.\nC: Ya lah, that\'s true.\nB: And there\'s also a lot of pollution.\n\nC: I think, I think Phuket might be better for you. You know, just sit in the sun on the beach.\nB: The beach.'}]","
C: Wanna go Bangkok?
C: I\'m...

B: But you know, one thing about Bangkok is that it\'s very congested.
C: Ya lah, that\'s true.
B: And there\'s also a lot of pollution.

C: I think, I think Phuket might be better for you. You know, just sit in the sun on the beach.
B: The beach.","[""lah51""]",,,2,1,FALSE
"[{'role': 'user', 'content': '\nC: Laze around and do nothing.\nB: Eh, beach.\nC: Ya lah, beach.\nC: But then eh, beach got a lot of those Ang Moh lang leh.\nB: So?\nC: I mean, I\'ve been there and then it\'s nice lah. You know, like nice sand, nice white sand, you know very fine.'}]","


C: Johnny say we should chill at the beach. But then, beach got a lot of those Ang Moh lang leh.
B: So?
C: I mean, I\'ve been there and then it\'s nice lah. You know, like nice sand, nice white sand, you know very fine.","[""leh21"", ""lah51""]",,,4,3,FALSE
"[{'role': 'user', 'content': '\nB: Eh, really or not?\nA: My goodness!\nA: Wah, you really open up when you are there.\nC: No lah, I don\'t have the figure for a bikini.\nC: I mean, I\'m saying you can wear one.\nB: Because she won\'t meet anybody else except us.\nC: No.'}]","

A: Wah, you are so smart!
C: No lah, I am not that good at math.
","[""lah21""]",,,2,1,FALSE
"[{'role': 'user', 'content': '\nC: Ya.\nB: Oh dear.\nC: I don\'t know, I mean, so ya lah. It\'s nice lah. I would say.\nB: So how?'}]","
B: How is the taste of the chicken rice?
C: I don\'t know how to describe it, I mean, ya lah, it\'s nice lah, I would say.
","[""lah51"", "" lah51""]",,,3,2,FALSE
"[{'role': 'user', 'content': '\nA: So, I think parents can be asked to fork out there.\n\nB: Okay, so these are some of the ways, and some very specific ways would be uh, written communication where there are class bulletins, there are newsletters - especially for parents - got to bring the facts there.\n\nA: Now, I was in the hospital last time *laughs*.\n\nB: Yeah, okay so there are special newsletters for parents, involve parents in school and future events and uh, some achievements of students there and things like that lah, okay.\n\nA: Uh, as far as I know, ACS has one Report Express.\n\nB: Not sure about other schools.\n\nA: Have you come across any?'}]","
A: So, I think parents can be asked to fork out there.

B: Okay, so these are some of the ways, and some very specific ways would be uh, written communication where there are class bulletins, there are newsletters - especially for parents - got to bring the facts there.

A: Now, I was in the hospital last time *laughs*.

B: Yeah, okay so there are special newsletters for parents, involve parents in school and future events and some achievements of students there and things like that lah.

","[""lah51""]",,,2,1,FALSE
"[{'role': 'user', 'content': '\n1.0: ""Eh, you asking or not?""\n1.0: ""Come, come, ask lah.""\n1.0: ""Can all of you hear or not?""\n1: ""Louder lah, come on!""\n1.0: ""The mike cannot hear, hurry up, louder!""\n1.0: ""Okay, how come got reverse bias to the p and the n is it?""\n1.0: ""Let\'s say I don\'t have this one, okay?""'}]","
A: ""Eh, are you asking the teacher or not?""
C: ""Probably not""
B: ""You wanted to ask a question? Come come, just ask lah.""
","[""lah51""]",,,3,2,FALSE
"[{'role': 'user', 'content': '\nD: Eh, am I speaking properly?\nC: Dunno leh.\n\nD: I always speak like this one.'}]","
D: Eh, am I speaking properly?
C: Dunno leh.
D: I always speak like this one.","[""leh33""]",,,2,1,FALSE
"[{'role': 'user', 'content': '\nD: Aiyo, she haven\'t had lunch yet?\nA: Yea, and B also.\nC: Oh no, poor thing. And you just waited for us.\nA: No lah, I was doing something lah.\nC: Then what time were you expecting us actually?\nA: I was finishing my work around three-ish or four-ish for twenty minutes.'}]","
D: Aiyo, she haven\'t had lunch yet?
A: Yea, and B also.
C: Oh no, poor thing. And you just waited for us.
A: No lah, I was doing something lah.
C: Then what time were you expecting us actually?
A: I was finishing my work around three-ish or four-ish for twenty minutes.","[""lah21""]",,,3,2,FALSE
"[{'role': 'user', 'content': '\nC: ""But if she really wants to leave, she should. But she should give herself a year or two to really decide, you know.""\n\nB: ""Can she tahan (tolerate) a year or two?""\n\nC: ""That, or she can try another school.""\n\nA: ""No, she was never cut out for teaching lah, anyway.""\n\nA: ""But she doesn\'t mind teaching, you know. It\'s all the...""\n\nC: ""That\'s what all teachers say, uh.""\n\nA: ""Ya ya.""'}]","
C: ""But if she really wants to leave, she should. But she should give herself a year or two to really decide, you know.""

B: ""Can she tahan (tolerate) a year or two?""

C: ""That, or she can try another school.""

A: ""No, she was never cut out for teaching lah, anyway.""

A: ""But she doesn\'t mind teaching, you know. It\'s all the...""

C: ""That\'s what all teachers say, uh.""

A: ""Ya ya.""","[""lah21""]",,,2,1,FALSE
"[{'role': 'user', 'content': '\nD: So there\'s nothing much lah, is there?\nA: Why work for admin?\nD: So are you looking around for a job as well?\nB: aiyah, teaching is boring lah. You know what I mean, they\'re just not interested. So this year, I got very bored\nC: You\'re teaching first-year is it this year?'}]","
D: So there\'s nothing much lah, is there?
A: Why work for admin?
D: So are you looking around for a job as well?
B: aiyah, teaching is boring lah. You know what I mean, they\'re just not interested. So this year, I got very bored
C: You\'re teaching first-year is it this year?","[""lah51"", "" lah21""]",,,2,1,FALSE
"[{'role': 'user', 'content': '\nA: Do they see beyond \'A\' levels?\nA: I mean, what do they see beyond \'A\' levels?\nB: University, which they can\'t get into.\nA: Ya lah, be realistic.'}]","
A: Do they see beyond \'A\' levels?
A: I mean, what do they see beyond \'A\' levels?
B: University, which they can\'t get into.
A: Ya lah, be realistic.","[""lah51""]",,,2,1,FALSE
"[{'role': 'user', 'content': '\nC: I mean, two years from now, right?\nC: Once I\'ve spent two years there, I\'m gonna feel the same way lah, you know.\nB: No lah.\nB: What are you trying to say?\nC: So, I\'ll look for a new job again.'}]","
C: I mean, two years from now, right?
C: Once I\'ve spent two years there, I\'m gonna feel the same way lah, you know.
B: No lah.
B: What are you trying to say?
C: So, I\'ll look for a new job again.","[""lah21"", "" lah21""]",,,3,2,FALSE
"[{'role': 'user', 'content': '\nC: Sorry, I didn\'t catch that word for the rest of the year.\nA: Yeah?\nB: Yeah.\nC: So he\'s looking for other things, you know. They said they prefer internal transfers, but they need someone who can jump in right away. He doesn\'t have marketing experience.\nC: But he will gain marketing experience soon, and then they can employ him, okay?\nC: Already he can do freelance lah, you know. Because he doesn\'t want to jeopardize his future.'}]","
C: Sorry, I didn\'t catch that word for the rest of the year.
A: Yeah?
B: Yeah.
C: So he\'s looking for other things, you know. They said they prefer internal transfers, but they need someone who can jump in right away. He doesn\'t have marketing experience.
C: But he will gain marketing experience soon, and then they can employ him, okay?
C: Already he can do freelance lah, you know. Because he doesn\'t want to jeopardize his future.","[""lah21""]",,,1,0,FALSE
"[{'role': 'user', 'content': '\nC: So he\'s looking for other things, lah. So they said, ""Uhm, we prefer internal transfers. But we need someone who can jump in right away, and he doesn\'t have marketing experience.""\n\nC: But he will gain marketing experience soon, and then they can employ him, okay. Already he can do freelance, lah. You know, because he doesn\'t want to jeopardize his future. Who knows? Your company might close down or what, huh?""\n\nA: ""Ya, don\'t know. I wonder how much we\'ll need.""'}]","
C: So he\'s looking for other things, lah. So they said, ""Uhm, we prefer internal transfers. But we need someone who can jump in right away, and he doesn\'t have marketing experience.""

C: But he will gain marketing experience soon, and then they can employ him, okay. Already he can do freelance, lah. You know, because he doesn\'t want to jeopardize his future. Who knows? Your company might close down or what, huh?""

A: ""Ya, don\'t know. I wonder how much we\'ll need.""","[""lah21""]",,,3,2,FALSE
"[{'role': 'user', 'content': '\nB: ""Eh, until the man and the woman selling it look very old. They\'re not even selling it for very long.""\n\nD: ""Excuse me, please lah. You\'re spreading people\'s doom like that, confirm plus chop.""\n\nA: ""No lah, sometimes you see these old couples selling stuff, you know""'}]","
B: ""Eh, until the man and the woman selling it look very old. They\'re not even selling it for very long.""

D: ""Excuse me, please leh. You\'re spreading people\'s doom like that, confirm plus chop.""

A: ""No lah, sometimes you see these old couples selling stuff, you know""","[""leh33"", ""lah21""]",,,4,3,FALSE
