0,,hylabel,yz_label,agreed,num_singlish,num_singlish_yz,num_particles_match
"[{'role': 'user', 'content': '\nD: It\'s very hard work.\nA: You know what I mean.Like this couple I know, they sell Hokkien mee, but nobody, I mean, buys from them you know?\nD: Because not nice lah.\nB: Then how they survive?\nA: Don\'t know'}]","
D: It\'s very hard work.
A: You know what I mean. Like this couple I know, they sell Hokkien mee, but nobody buys from them you know?
D: Because the food is not nice lah.
B: Then how did the couple survive?
A: Don\'t know
","[""lah51""]",,,3,2,FALSE
"[{'role': 'user', 'content': '\nA: Eh, do you swim?\nB: No, but you can go snorkeling what.\nA: I don\'t even know how to snorkel.\nB: Wear a life-jacket lah.'}]","
A: Eh, do you swim?
B: No, but you can go snorkeling what.
A: I don\'t even know how to snorkel.
B: Wear a life-jacket lah.","[""lah51""]",,,2,1,FALSE
"[{'role': 'user', 'content': '\nB: Eh, how is she?\nA: Eh, she\'s very busy.\nB: Eh, eh...\nA: I used to talk to her every day. Until last week, she told me not to call her because she will be not around lah.'}]","
B: Eh, how is she?
A: She\'s very busy. I used to talk to her every day. Until last week, she told me not to call her. I think she will be not around lah.","[""lah21""]",,,2,1,FALSE
"[{'role': 'user', 'content': '\nA: Then we\'ll go without a car, is it?\nB: Ya, until the COE comes down.\nB: You have to walk to the main road lah.\nA: Ah, then take the MRT.\nTake the bus, but it\'s a lot of inconvenience lah.'}]","
A: Then we\'ll go without a car, is it?
B: Ya, until the COE comes down.
B: You have to walk to the main road lah.
A: Ah, then take the MRT. You can also take the bus, but it\'s a lot of inconvenience lah.","[""lah21"" , ""lah51""]",,,3,2,FALSE
"[{'role': 'user', 'content': '\nA: Eh, it\'s less than one, for sure.\nA: My area only got bungalows can fetch one.\nA: Even semi-detached, maybe eight only lah. Because until now, still not considered very prime, you see.'}]","

A: My area only got bungalows can fetch one.
A: Even semi-detached, maybe eight only lah. Because until now, still not considered very prime, you see.","["" lah21""]",,,2,1,FALSE
"[{'role': 'user', 'content': '\nA: This thing ah?\nB: Mmm...\nA: After we finish lor. After you finish, it will stop.\nB: I feel very uncomfortable, very uneasy.'}]","
A: This thing ah?
B: Mmm...
A: After we finish lor. After you finish, it will stop.
B: I feel very uncomfortable, very uneasy.","[""lor33""]",,,2,1,FALSE
"[{'role': 'user', 'content': '\nA: Wei Ho changed his whole style of dressing.\nB: Eh, I saw him in shocking yellow the other day leh!\nA: Yah lor, we call him ""the Frank"" you know because Frank also wear yellow sometimes.\nA: Actually, we had a bet with him lah. Ah John said, if he changes his image, then he will buy him new shirts.'}]","
A: Wei Ho changed his whole style of dressing.
B: Eh, I saw him in shocking yellow the other day leh!
A: Yah lor, we call him ""the Frank"" you know because Frank also wear yellow sometimes.
A: Actually, we had a bet with him lah. Ah John said, if he changes his image, then he will buy him new shirts.","[""leh51"", ""lor33"", ""lah21""]",,,5,4,FALSE
"[{'role': 'user', 'content': '\nA: If he change, he give us ten dollars. \nA: Actually, we challenge him for two years already lah. But he never take on the challenge.'}]","
A: If he change, he give us ten dollars. 
A: Actually, we challenge him for two years already lah. But he never take on the challenge.","[""lah21""]",,,3,2,FALSE
"[{'role': 'user', 'content': '\nB: He must lose some weight.\nA: Ya lah, it\'s true, no joke.'}]","
B: He must lose some weight.
A: Ya lah, it\'s true, no joke.","[""lah51""]",,,2,1,FALSE
"[{'role': 'user', 'content': '\nB: I know I depend on my husband for all the practical things in life. He depends on me for the emotional support that I can give, you know? So it\'s a partnership lah, you know.\nD: I have come to think, in a sense, it's just sad lah, you know'}]","
B: I know I depend on my husband for all the practical things in life. He depends on me for the emotional support that I can give, you know? So it\'s a partnership lah, you know.
D: I have come to think, in a sense, it's just sad lah, you know","[""lah51"", ""lah21""]",,,3,2,FALSE
"[{'role': 'user', 'content': '\nB: This year's winner is team forty-eight.\nA: Oh.Then what leh? Uh, the second prize is what?'}]","
B: This year's winner is team forty-eight.
A: Oh.Then what leh? Uh, the second prize is what?","[""leh33""]",,,3,2,FALSE
"[{'role': 'user', 'content': '\nA: Anyway, your children are free also what?\nB: Ya, but aiyah, have to look after them. Then also too late already... \nA: Maybe you bring one instead of two lah. '}]","
A: Anyway, your children are free also what?
B: Ya, but aiyah, have to look after them. Then also too late already... 
A: Maybe you bring one instead of two lah. ","[""lah51""]",,,2,1,FALSE
"[{'role': 'user', 'content': '\nB: If we bring him along, you still have to rush back to fetch him.\nA: That night don\'t bring him along lor. Can or not?\nB: I think it\'s very bad.\nA: It\'s okay lah, once in a while, don't need to always attend relative's wedding dinner.'}]","
B: If we bring him along, you still have to rush back to fetch him.
A: That night don\'t bring him along lor. Can or not?
B: I think it\'s very bad.
A: It\'s okay lah, once in a while, don\'t need to always attend relative's wedding dinner.","[""lor33"", ""lah24""]",,,3,2,FALSE
"[{'role': 'user', 'content': '\nA: Eh,\nB: So tomorrow, let me know what prize you got lah.'}]","
A: Eh, the competition is tomorrow. I think I will do well!
B: So tomorrow, share with me the prize money lah.","[""lah24""]",,,2,1,FALSE
"[{'role': 'user', 'content': '\nB: Oh.\nB: Then who, who are those two?\nA: He got another son and daughter lor.'}]","
B: Oh.
B: Then who, who are those two?
A: He got another son and daughter lor.","[""lor33""]",,,4,3,FALSE
"[{'role': 'user', 'content': '\nA: How much money you need?\nB: I think $300 lah, for Dr. Teo lah.'}]","
A: How much money you need?
B: I think $300 lah, for Dr. Teo lah.","[""lah21"", ""lah51""]",,,3,2,FALSE
"[{'role': 'user', 'content': '\nB: ""$200 for two tickets, is it? Whoa, that means this ride is more expensive than the previous one.""\n\nA: ""Ya lah, confirm plus chop. I think it is too expensive. What about this other ride leh?""'}]","
B: ""$200 for two tickets, is it? Whoa, that means this ride is more expensive than the previous one.""

A: ""Ya lah, confirm plus chop. I think it is too expensive. What about this other ride leh?""","[""lah51"", ""leh33""]",,,4,3,FALSE
"[{'role': 'user', 'content': '\nB: So Eileen going or not?\nA: Eileen not lah.'}]","
B: So Eileen going or not?
A: Eileen not lah.","[""lah21""]",,,3,2,FALSE
"[{'role': 'user', 'content': '\nB: ""Eh, you see Yen Jing these days or not?""\n\nA: ""Eh, once in a while lah.""\n\nB: ""Wah, very slim leh.'}]","
B: ""Eh, you see Yen Jing these days or not?""

A: ""Eh, once in a while lah.""

B: ""Wah, very slim leh.","[""lah21"", ""leh33""]",,,4,3,FALSE
"[{'role': 'user', 'content': '\n\nB: I wonder who will get the first prize leh.\nA: Yah lor, last time Sandra got it.'}]","

B: I wonder who will get the first prize leh.
A: Yah lor, last time Sandra got it.","[""leh33"", ""lor33""]",,,6,5,FALSE
"[{'role': 'user', 'content': '\n\nB: Who do you think will get first prize leh?'}]","

B: Who do you think will get first prize leh?","[""leh33""]",,,2,1,FALSE
"[{'role': 'user', 'content': '\nB: So, back to the topic about my suite. So the glass is transparent lah. You can actually see the number of people inside the room lor.\nA: Oh, I see. But the suite is just a sofa only, right?\nB: Ah, got it.'}]","
B: So, back to the topic about my suite. So the glass is transparent lah. You can actually see the number of people inside the room lor.
A: Oh, I see. But the suite is just a sofa only, right?
B: Ah, got it.","[""lah51"", ""lor33""]",,,4,3,FALSE
"[{'role': 'user', 'content': '\nB: Oh, is your husband a member of the company?.\nA: Ya, he is leh. It is his company'}]","
B: Oh, is your husband a member of the company?.
A: Ya, he is leh. It is his company","[""leh33""]",,,4,3,FALSE
"[{'role': 'user', 'content': '\nA: One day we should go karaoke leh.\nB: Ah, you want?\nA: Ya, if we have more people lah.'}]","
A: One day we should go karaoke leh.
B: Ah, you want?
A: Ya, if we have more people lah.","[""leh33"", ""lah51""]",,,4,3,FALSE
"[{'role': 'user', 'content': '\nA: What do you want to eat leh?'}]","
A: What do you want to eat leh?","[""leh33""]",,,3,2,FALSE
"[{'role': 'user', 'content': '\nB: Ya.\nA: Only $2, it\'s worth.\nB: That\'s excluding drinks, ah?\nA: Ya lah, no drinks one. '}]","
B: Ya.
A: Only $2, it\'s worth.
B: That\'s excluding drinks, ah?
A: Ya lah, no drinks one. ","[""lah51""]",,,2,1,FALSE
"[{'role': 'user', 'content': ':\nB: ""Maybe I did, I can\'t remember, I\'ll try.""\n\nA: ""You see if you can find lah.""\nB: ""Ya.""'}]",":
B: ""Maybe I did, I can\'t remember, I\'ll try.""

A: ""You see if you can find lah.""
B: ""Ya.""","[""lah51""]",,,2,1,FALSE
"[{'role': 'user', 'content': '\nA: In the letter, your rehearsal time is from what time to what time, then another organization\'s time is from what time to what time? Tell the banquet manager to prepare. For example,  we need how many standing mics and all that lah.'}]","
A: In the letter, your rehearsal time is from what time to what time, then another organization\'s time is from what time to what time? Tell the banquet manager to prepare. For example,  we need how many standing mics and all that lah.","[""lah51""]",,,3,2,FALSE
"[{'role': 'user', 'content': '\nB: If anything happens, here is my number.\nA: Just in case, right?\nB: For emergency cases lah. Because there are no embassies around here.'}]","
B: If anything happens, here is my number.
A: Just in case, right?
B: For emergency cases lah. Because there are no embassies around here.","[""lah51""]",,,2,1,FALSE
"[{'role': 'user', 'content': '\nB: The deejay\'s thing on stage, the rostrum and all that then.\n\nA: Then I ask her, ""do we have a day-room that we can store our props?""\n\nB: Uhm.\n\nA: Then she say, ""No, just at the usual  place lah.""'}]","
B: The deejay\'s thing on stage, the rostrum and all that then.

A: Then I ask her, ""do we have a day-room that we can store our props?""

B: Uhm.

A: Then she say, ""No, just at the usual  place lah.""","[""lah51""]",,,2,1,FALSE
"[{'role': 'user', 'content': '\nB: Will they have enough rooms for you and your family and friends?\\nA: So I think not enough lah, there are too many people around.'}]","
B: Will they have enough rooms for you and your family and friends?\
A: So I think not enough lah, there are too many people around.","[""lah21""]",,,2,1,FALSE
"[{'role': 'user', 'content': '\nA: Please sign over here.\nB: Okay, I copy here?\nA: Ya lah, here'}]","
A: Please sign over here.
B: Okay, I copy here?
A: Ya lah, here","[""lah21""]",,,6,5,FALSE
"[{'role': 'user', 'content': '\nA: So, I have to go to Germany first, then come back again to Amsterdam, is it?\nB: Oh my gosh!\nB: Why leh?\nA: I don\'t know lah... I don\'t know whether I should or not.'}]","
A: So, I have to go to Germany first, then come back again to Amsterdam, is it?
B: Oh my gosh!
B: Why leh?
A: I don\'t know lah... I don\'t know whether I should or not.","[""leh33"", ""lah21""]",,,3,2,FALSE
"[{'role': 'user', 'content': '\nA: So gaudy sia, so gaudy. Like rococo or the ice-cream cake topping?\nB: All of them?\nA: No lah, don't want.'}]","
A: So gaudy sia, so gaudy. Like rococo or the ice-cream cake topping?
B: All of them?
A: No lah, don\'t want.","[""lah21""]",,,4,3,FALSE
"[{'role': 'user', 'content': '\nA: Belvedere is nice because of the painting, ah?\nB: Ha.\nA: This one also nice because got gardens.\nB: Ya lah.'}]","
A: Belvedere is nice because of the painting, ah?
B: Ha.
A: This one also nice because got gardens.
B: Ya lah.","[""lah21""]",,,2,1,FALSE
"[{'role': 'user', 'content': '\nB: Ya.\nB: So you have about two to one hour to catch the train in Italy.\nA: Ya, but I don\'t trust the Italian trains.\nB: So a bit earlier lah, say reach there about five o\'clock.'}]","
B: Ya.
B: So you have about two to one hour to catch the train in Italy.
A: Ya, but I don\'t trust the Italian trains.
B: So a bit earlier lah, say reach there about five o\'clock.","[""lah51""]",,,2,1,FALSE
"[{'role': 'user', 'content': '\nB: ""His health issue was presented for more than two years after the accident, you know? And I would therefore assume that it would be permanent.""\n\nA: ""From this injury to his brain, would there be any side effects like for instance, loss of memory, headaches, relapses?""\n\nB: ""He could have mental problems, but by his own testimony, he did not complain of headaches and said he was otherwise normal leh. '}]","
B: ""His health issue was presented for more than two years after the accident, you know? And I would therefore assume that it would be permanent.""

A: ""From this injury to his brain, would there be any side effects like for instance, loss of memory, headaches, relapses?""

B: ""He could have mental problems, but by his own testimony, he did not complain of headaches and said he was otherwise normal leh. ","[""leh33""]",,,4,3,FALSE
"[{'role': 'user', 'content': '\nA: I am going to bring my credit card overseas.\nC: Okay, what about cash leh?'}]","
A: I am going to bring my credit card overseas.
C: Okay, what about cash leh?","[""leh33""]",,,2,1,FALSE
"[{'role': 'user', 'content': '\nB: ""They might not have loose change.""\nB: ""In fact, they might want to sing dollars from you.""\nC: ""Then they might ask you to buy less sing dollar is it?""\nB: ""Ya lor.""\nA: ""Doesn\'t matter lah.'}]","
B: ""They might not have loose change.""
B: ""In fact, they might want to buy sing dollars from you.""
C: ""Then they might ask you to buy less sing dollar is it?""
B: ""Ya lor.""
A: ""Doesn\'t matter lah.","[""lor33"", ""lah21""]",,,7,6,FALSE
"[{'role': 'user', 'content': '\nA: Let's see, we need to calculate how many cakes we have per person. 500 cakes divide by 24 people.\nB: About 20 lor.'}]","
A: Let's see, we need to calculate how many cakes we have per person. 500 cakes divide by 24 people.
B: About 20 lor.","[""lor33""]",,,2,1,FALSE
"[{'role': 'user', 'content': '\nC: You must try and catch a fish lah.\nB: Oh, the doesn\'t matter lah.\nB: Ya, you could just catch ten smaller ones.'}]","
C: You must try and catch a fish lah.
B: Oh, the doesn\'t matter lah.
B: Ya, you could just catch ten smaller ones.","[""lah21"", ""lah21""]",,,4,3,FALSE
"[{'role': 'user', 'content': '\nA: Miss P, how many days are we in Austria leh?\nD: Calculate lah, got itinerary right there what.'}]","
A: Miss P, how many days are we spending in Austria leh?
D: Calculate lah, got itinerary right there what.","[""leh33"", ""lah51""]",,,4,3,FALSE
"[{'role': 'user', 'content': '\nA: So, what would you do before giving a presentation to your boss?\nB: Wait, let me collect my thoughts first. Hmm, maybe I would just run through a bit about the background lah'}]","
A: So, what would you do before giving a presentation to your boss?
B: Wait, let me collect my thoughts first. Hmm, maybe I would just run through a bit about the background lah","[""lah21""]",,,2,1,FALSE
"[{'role': 'user', 'content': '\nB: How old are they?\n\nA: Just about maybe around two years, I think.\n\nB: You mean you took them together one after another?\n\nA: They, uh, sort of almost lah.\n'}]","
B: How old are they?

A: Just about maybe around two years, I think.

B: You mean you took them together one after another?

A: They, uh, sort of almost lah.
","[""lah21""]",,,3,2,FALSE
"[{'role': 'user', 'content': '\nA: Uhm\nB: If you have visions for your sons, you know, you should tell them, maybe for post-graduate studies or something.\nA: Uhm\nB: You know you will have to plan for more lah.\nA: Okay okay.\nB: Uhm, which adverts do you like?\nA: I think the latest one I received is from CIGNA.'}]","
B: If you have a vision for your sons, you know, you should tell them, maybe for post-graduate studies or something. You know you will have to plan for more lah.
","[""lah51""]",,,2,1,FALSE
"[{'role': 'user', 'content': '\nA: Eh, then maybe make an assessment whether I can afford or I can\'t afford.\nB: Ah, okay leh. Let me just run through quickly.\nA: Uhm...\nB: Uhm, they come in many names lah, okay. Basically, they\'re of a temporary nature.\nA: Uhm...'}]","
A: Eh, then maybe make an assessment whether I can afford or I can\'t afford.
B:  Let me just run through quickly.
B: Umm... actually you are okay leh.","[""leh33""]",,,3,2,FALSE
"[{'role': 'user', 'content': '\nA: Eh...\nB: Okay lah.\nA: Eh...\nB: But you know, generally got two ways lah, either one or the other.\nA: Eh...\nB: Okay, okay. Main thing is, the difference is whether you want to make sure it can do its job or not.'}]","

B: Generally got two ways lah, either one or the other.
A: Okay so which way is better?

","[""lah21""]",,,3,2,FALSE
"[{'role': 'user', 'content': '\nA: Okay.\nB: Okay. Eh, what else do they have? I think that\'s basically it lah. It\'s only in the packaging.\nA: Uhm.\nB: Uhm, I don\'t know whether...'}]","

B: Eh, what else do they sell, other than cakes and bread? 
A: I think that\'s basically it l","[""lah21""]",,,2,1,FALSE
"[{'role': 'user', 'content': '\nA: Of course lah.\nB: That\'s just the trend, you know?\nA: Okay lah.\nB: Uhm, these things tend to be more popular nowadays, you see?\nA: Uhm, ya lor.'}]","

B: That\'s just the trend, you know?
A: Of course lah.
","[""lah51""]",,,4,3,FALSE
"[{'role': 'user', 'content': '\nB: ""There\'s no loss, leh.""\n\nA: ""I see, I see, okay lah.""\n\nB: ""Uhm...""\n\nA: ""So all the interest, ah?""\n\nB: ""Ya, but there\'s I think got some offsetting along the way. Finally, can catch up, you know?""\n\nA: ""Is that right or not?""\n\nB: ""Got a small cost involved, also got insurance.""'}]","
B: ""There\'s no loss leh. Why are you so scared to take the chance?""

A: ""I see, I see, okay lah.""
","[""leh33"", ""leh21""]",,,3,2,FALSE
"[{'role': 'user', 'content': '\nA: ""Eh, word.""\nB: ""Uh huh, if you look at it from that point of view.""\nA: ""Uhm, uhm, okay.""\nB: ""Okay, that\'s what I meant lah.""\nA: ""Uhm.""'}]","

B: ""If you look at it from that point of view, I guess you're right.""

A: ""Yes that\'s what I meant lah.""
","[""lah51""]",,,2,1,FALSE
"[{'role': 'user', 'content': '\nA: It\'s just not up to the thirtieth of November, but of course don\'t wait until the last minute, because there might be some complications, who knows?\nB: You think something like a telecoms rush?\nA: Yeah, yeah, you\'d be surprised, you know?\nB: No lah, what telecoms rush? You won\'t have another telecoms rush.\nA: No, what I mean is of course not. But what I\'m trying to say is, okay, give us two weeks, you know? Because maybe you need a medical check-up, you know.'}]","
A: Don\'t wait until the last minute to submit your assignment, because there might be some complications, who knows?
B: You think something might happem?
A: Yeah, yeah, you\'d be surprised, you know?
B: No lah, no way.
","[""lah21""]",,,2,1,FALSE
"[{'role': 'user', 'content': '\nB: I thought you were doing pretty well.\nA: Uhm, I think it was more for the long term, but uh, right now is running into difficulties because of all these extensions.\nB: Oh, I see.\nB: In that case, you maybe you have expanded too fast lah, over the last two to three years.\nA: Maybe a bit too fast lah.\nB: I see, I see.\nB: Well, anyway, you are not the only customer.'}]","
B: I thought you were doing pretty well.
A: Right now I'm running into difficulties because of all these extensions.
B: In that case, maybe you have expanded your company too fast lah, over the last two to three years.
","[""lah21""]",,,3,2,FALSE
"[{'role': 'user', 'content': '\nA: Eh, I, it was more for the long term but now got difficulties because of all these extensions.\nB: Oh, I see.\nB: In that case, maybe you expand too fast lah, the last few years.\nA: Ya, maybe a bit too fast lah.\nB: I see, I see.\nB: Well anyway, you not the only customer. In fact, I just visited two other customers yesterday at Jurong, everybody looks like got some problem here and there.'}]","

B: Well anyway, you not my only customer. In fact, two other customers visited yesterday, everybody looks like got some problem here and there, I don\'t know why leh.","[""leh33""]",,,3,2,FALSE
"[{'role': 'user', 'content': '\nA: Right.\nB: Ya, what about Indonesia? Do you think they would be of any help if they win over the elections and a more stable government is in place?\nA: Uh, I think it\'s going to take time lah, with all the violence going around there. I think it will still take years, even when a stable government is elected.\nB: Well, that\'s very sad. I mean, as bankers, we always hear such comments. It makes us jittery, man. Anyway, thanks for allowing us to come by to visit you today.'}]","

B: Ya, what about Indonesia? Do you think they would be of any help if they win over the elections and a more stable government is in place?
A: Uh, I think it\'s going to take time lah, with all the violence going around there. I think it will still take years, even when a stable government is elected.
B: Well, that\'s very sad.","[""lah21""]",,,2,1,FALSE
"[{'role': 'user', 'content': '\nB: Ya, what about Indonesia?\nB: You think Indonesia would be of any help if they really win over the elections and a more stable government is in place?\nA: Uh, I think it\'s going to take time lah, with all the violence going around there.\nA: I think it\'s still going to take years, even when a stable government is elected.\nB: Well, that\'s very sad man.\nB: I mean, as bankers, we always hear these kinds of comments that make us jittery. Anyway, thanks for allowing us to come by to visit you today.\nB: Actually, we just want to come up to update you on our annual exercises lah.'}]","
B: You think Indonesia would be of any help if they really win over the elections and a more stable government is in place?
A: Uh, I think it\'s going to take time lah, with all the violence going around there. I think it\'s still going to take years, even when a stable government is elected.
B: Well, that\'s very sad man. I mean, as bankers, we always hear these kinds of comments that make us jittery. Anyway, thanks for allowing us to come by to visit you today. We just want to come up to update you on our annual exercises lah.","[""lah21"", ""lah21""]",,,3,2,FALSE
"[{'role': 'user', 'content': '\nB: Ya, must reduce.\n\nA: So I try call as many as possible, see how.\nB: Ah, I know already a bit difficult. Given the situation what, times are bad and all. But we really really must come out today to tell you, basically these are some of the intentions that the bank is adopting.\n\nA: But my business already so bad, I really got strict cash flow problem. All my facilities in this factory already stretched to the maximum, then how come you come and tell me you want reduce my OD line some more?\n\nA: I really don\'t know lah. I really don\'t know.\n\nB: Uh, but actually what we can do is, we understand your problem. But we really hope that Mr Tan, you can understand our position also lah.\n\nB: Although a lot of time people say banks during rainy days will take away the umbrella.'}]","

A: But my business already so bad, I really got strict cash flow problem. All my facilities in this factory already stretched to the maximum, then how come you come and tell me you want reduce my OD line some more?

A: I really don\'t know lah. I really don\'t know.

B: Uh, but actually what we can do is, we understand your problem. But we really hope that Mr Tan, you can understand our position also lah.
","[""lah21"", ""lah51""]",,,3,2,FALSE
"[{'role': 'user', 'content': '\nA: Eh, but my business already so bad leh. I really got this serious cash flow problem, and all my factory\'s facilities already stretched until almost max out liao. How can you all come and tell me need to reduce my OD line some more?\n\nA: I really don\'t know leh...\n\nB: Uh, but you see lah, what we can do is understand your problem. But we really hope Mr Tan, you can understand our position also lah.\n\nB: Although people always say banks will take away the umbrella during rainy days, but you all also must know that we also quite affected, you know? Property value drop, got that also.'}]","
A: Eh, but my business already so bad leh. I really got this serious cash flow problem, and all my factory\'s facilities already stretched until almost max out liao. How can you all come and tell me need to reduce my OD line some more?

A: I really don\'t know leh...

B: Uh, but you see, what we can do is understand your problem. But we really hope Mr Tan, you can understand our position also lah.
","[""leh33"", ""leh33"", ""lah51""]",,,5,4,FALSE
"[{'role': 'user', 'content': '\nB: So, if thats the case, then I would suggest: is to reduce it back to the point again. Its five, meaning, what I said earlier was that head office imposed 200,000 on your account. But Im looking at maybe a gradual basis, what about 5,000 per month? Can you manage that for now?\n\nSo every month, we reduce by 5,000 lah.'}]","
B: So, if thats the case, then I would suggest: is to reduce it back to the point again. Its five, meaning, what I said earlier was that head office imposed 200,000 on your account. But Im looking at maybe a gradual basis, what about 5,000 per month? Can you manage that for now?

So every month, we reduce by 5,000 lah.","[""lah51""]",,,2,1,FALSE
