0,,hylabel,yz_label,agreed,num_singlish,num_singlish_yz,num_particles_match
"[{'role': 'user', 'content': '\nB: ""Eh, within a week\'s time, then we see how we go from there. If got any problem, then what we do is this: after six months, okay, we will come back to you again. Then we can sit down and discuss further.\n\nB: I mean, let\'s hope that the economy will recover by then. Right now, the biggest problem we have is that we actually sitting on a lot of properties, you know? For example, these factories that you have now. Last year when I came in, it was something like three point five million. Today, we are looking at two million only, so straightaway we are looking at a negative network of about one point five million. This is the biggest headache we are facing.\n\nB: But never mind lah, don\'t worry. I will come to you in say, one week\'s time. Then we see how we go from there.""\n\nA: ""What about your bank?""'}]","

B: I mean, let\'s hope that the economy will recover by then. Right now, the biggest problem we have is that we actually sitting on a lot of properties, you know? For example, these factories that you have now. Last year when I came in, it was something like 3.5 million. Today, we are looking at 2 million only, so straightaway we are looking at a negative network of about 1.5 million. This is the biggest headache we are facing.

B: But never mind lah, don\'t worry. I will come to you in say, one week\'s time. Then we see how we go from there.

","[""lah21""]",,,2,1,FALSE
"[{'role': 'user', 'content': '\nB: Eh, banks also affect, we affect.\nB: In fact, if you read the annual reports of all the local banks, they are making hefty provisions for the affected industries. So you know, we are also badly hit lah.\nB: We are badly hit lah.\nB: So you know, we are not spared.\nB: Okay, we are not spared lah.\nA: Uhm, nice to know that I\'m not alone in all this.\nB: You also not spared, okay.'}]","

B: In fact, if you read the annual reports of all the local banks, they are making hefty provisions for the affected industries. So you know, we are also badly hit lah.
","[""lah51""]",,,4,3,FALSE
"[{'role': 'user', 'content': '\nA: Uhm, nice to know that I\'m not alone in all this.\nB: You\'re not spared, okay? All of us, we\'re business... uh, private organizations. We\'re not spared, but we have to be prudent, huh, just like living in Singapore, we have to be prudent.\nB: We have to, uh, protect the interests of our shareholders, depositors, and all that lah. But never mind, let\'s see how it goes.\nB: More important, I think, is that we want to see that we can help our local enterprises here to ride through these bad times. That\'s why I said we are always open for discussion. Although our intention is to reduce your OD limit by two hundred thousand, I think we can always look into a restructured payment.\nB: Five thousand, if it\'s too difficult for you, we can try it for six months.\nB: After six months, if you really have problems, come back to us, okay? Our doors are open anytime.'}]","
A: Uhm, nice to know that I\'m not alone in this.
B: All of us, we\'re business... uh, private organizations. We\'re not spared, but we have to be prudent.
B: We have to protect the interests of our shareholders, depositors, and all that lah. But never mind, let\'s see how it goes.
","[""lah51""]",,,2,1,FALSE
"[{'role': 'user', 'content': '\nC: Lim Ming Chuan still under medical leave. Last time also medical leave, you know?\nC: He went for a major operation.\nC: As for the rest, I don\'t know lah.\nC: Okay, anyway, before I go ahead, let me introduce our October issue and the balance.\nC: Okay.\nC: Okay then, I\'ll go through the Matter Arising.'}]","
C: Lim Ming Chuan still under medical leave. Last time also medical leave, you know?
C: He went for a major operation.
C: As for the rest, I don\'t know lah.","[""lah21""]",,,2,1,FALSE
"[{'role': 'user', 'content': '\nC: Eh, sorry leh. Before I go ahead, any amendments ah?\nD: Whose report?\nC: Never mind lah, you just go through. If got any amendments or corrections needed, just correct lah.\nC: Okay, Matter Arising...\nC: Okay, then I go through the Chairman\'s report.\nC: Okay, for item 4.1, P A Y invited a member to join the monthly competition, representing our...'}]","
C: Eh, sorry about that leh. Please forgive me.","[""leh33""]",,,4,3,FALSE
"[{'role': 'user', 'content': '\nC: ""Eh, this National Day dinner, will be held on the first of August, it\'s a Saturday leh. Our role is to get this thing, I mean our duty is to be in charge of this thing with a stage there lor. The decoration at the stage, I think lah.\n\nE: ""Decoration ah this thing?""'}]","
C: ""This National Day dinner will be held on the first of August, it\'s a Saturday. Our duty is to be in charge of this thing with a stage there lor. The decoration at the stage, I think lah.

E: ""This decoration?""","[""lor33"", ""lah51""]",,,4,3,FALSE
"[{'role': 'user', 'content': '\nC: Okay, another one will be ""Great & Great Win"". \nC: Okay, will be. \nC: The proposed date will be 12th of November 1998. \nC: So, weekday lah, but the committee has a... \nC: Because it falls on a weekday, they scared they can\'t get helper, lah. \nC: Then, they want to change to weekend, but they need to check with E and V. E and V, <unclear> word </unclear>. \nC: Okay, once I got more confirmed date then I\'ll...'}]","
C: The proposed date will be 12th of November 1998. 
C: So, weekday lah, but because it falls on a weekday, they scared they can\'t get helper.","[""lah51""]",,,3,2,FALSE
"[{'role': 'user', 'content': '\nB: Yeah yeah.\n\nH: Ah, we can mix lah, you know?\n\nG: My concern is I\'d like to see this platform as a means to develop your trainer skills. So if you see yourself in the future as a consultancy, use this as a 90% English and the remaining 10% Malay lah.\n\nH: You can\'t help it if you\'re a bit mixed up.\n\nG: Yeah lah, but as my concern, our medium is a rojak concept. But what we don\'t know is how to use Malay and English in one statement together lah.'}]","
B: I'm not sure whether to speak Malay or English leh.

H: Ah, we can mix lah, you know? Since our respondents are Malay, maybe 20% English and 80% Malay lor.
","[""leh33"", ""lah21"", ""lor33""]",,,5,4,FALSE
"[{'role': 'user', 'content': '\nG: Eh, the commitment is four hours leh.\nH: So for Class A, got one presenter, Class B also got one presenter is it?\nG: Ya lah, because you know what? In our thingy, we rent two classrooms for one class only leh.\nG: So, usually hor, when we engage our activity, there will be one girl and one guy.\nH: Actually not necessary one like that.\nG: Ya lah, you don\'t have to be so strict one.\nH: Is this monthly or weekly basis?'}]","
G: The commitment is four hours leh.
H: So for Class A, got one presenter, Class B also got one presenter is it?
G: Ya, because you know what? In our plan, we rent two classrooms for one class only leh.
","[""leh33"", ""leh33""]",,,5,4,FALSE
"[{'role': 'user', 'content': '\nB: Role-play, ah?\nA: Ya lah.\nB: Come.\nA: I\'m the interviewer, you you why you\'re the interviewee?\nB: You\'re not interviewing for a job, is it?\nA: I am lah, confirm plus chop.\nB: So since when you got promoted?'}]","
B: You want to role-play an interview, is it?
A: I want to be the interviewee, you want to be the interviewer?
B: You\'re not practicing for a job interview, is it?
A: I am lah, confirm plus chop.","[""lah21""]",,,3,2,FALSE
"[{'role': 'user', 'content': '\nA: ""It\'s correct lah.""\nA: ""Oh, that means if she include all the vulgarities, is it?""\nA: ""This one, don\'t know how to rate already.""\nB: ""Don\'t worry lah, the vulgarities won\'t be censored leh.""\nA: ""Usually you know what happens in a candid camera one, when it comes to vulgarities, right?""\nA: ""So this guy is damn \'beep beep beep beep\' one.""'}]","
B: ""Don\'t worry lah, the vulgarities won\'t be censored one.""
","[""lah21""]",,,4,3,FALSE
"[{'role': 'user', 'content': '\nA: Ya ya,\nA: But it\'ll be all men\'s talk, uh.\nB: I don\'t mean my vulgarity all coming out, uh.\nA: You just say ""beep beep"" lah.\nA: Beep.\nB: So, \'A\'?\nA: Is she your friend?'}]","

B: I don\'t mean my vulgarity all coming out.
A: You just say ""beep beep"" lah. (A is mimicking the sound of being censored)
","[""lah51""]",,,2,1,FALSE
"[{'role': 'user', 'content': '\nA: Oh.\nB: I can\'t rem (remember) the name of the building lah.\nA: Is it the mike on?\nB: Just happened to meet her there lah. That\'s it.\nA: Oh, she was the one that you\'re talking about. You have the card, right?'}]","
B: I can\'t rem (remember) the name of the building lah. Just happened to meet her there lah. That\'s it.
","[""lah21"", ""lah51""]",,,3,2,FALSE
"[{'role': 'user', 'content': '\nA: Every short interval.\nB: There\'s a diskette for this type of piano.\nB: Uh, I don\'t know what kind of disk, uh.\nA: I don\'t know lah, but you should have.\nA: I thought you should play if you have a compo set.\nA: You can play.\nB: Compo set.'}]","
B: There\'s a diskette for this type of piano.
B: Uh, I don\'t know what kind of disk that is.
A: I don\'t know lah, but you should have.
","[""lah21""]",,,2,1,FALSE
"[{'role': 'user', 'content': '\nB: Compo set.\n\nA: Using whatever.\n\nB: We can ask them to change the CD, or else it\'ll be playing that word round and round.\n\nB: Never mind lah.\n\nA: I want to talk to Shirley.\n\nB: Talk to Shirley, ah? Is she here?'}]","

B: We can ask them to change the CD, or else it\'ll be playing that word round and round. Actually, never mind lah.
","[""lah21""]",,,2,1,FALSE
"[{'role': 'user', 'content': '\nA: So two leh. Audio specialist offering it at two eight five five.\nB: Audio specialist? No lah, the other time we went to that Audio specialist, not Delphi what.\nA: No, yes. Yesterday one is more expensive what.\nB: Ya, they quoted a higher price.\nA: Yesterday, we were quoted a price of three one.'}]","
A: Audio specialist offering it at $2855.
B: Audio specialist? No lah, the other time we went to that Audio specialist, not Delphi what.
A: No, yes. Yesterday one is more expensive what.
B: Ya, they quoted a higher price.
A: Yesterday, we were quoted a price of $3100.","[""lah21""]",,,3,2,FALSE
"[{'role': 'user', 'content': '\nB: ""Two seven plus a pair of speakers.""\nB: ""Round about three.""\nA: ""You can get a Celestron, uh, SL-5.""\nB: ""No lah, cannot.""\nB: ""I don\'t like the sound, sounds too...""\nA: ""Session 5, uh, session 5 or session...""'}]","

A: ""You can get a Pikachu toy with $1.""
B: ""No lah, cannot.""
","[""lah21""]",,,2,1,FALSE
"[{'role': 'user', 'content': '\nA: Eh, I want to try the Rotel you know, and power.\nA: Although no doubt.\n\nB: Oh, Rotel is it?\nA: No lah, I don\'t think it\'s no good.\nB: I don\'t think the sound is fantastic, the sound keeps sticking there.\nA: No lah.'}]","


B: Oh, you're staying at the Fullerton Hotel is it?
A: No lah, I don\'t think it\'s good.
","[""lah21""]",,,3,2,FALSE
"[{'role': 'user', 'content': '\nB: I don\'t think the sound is fantastic, the sound is sticking there leh.\nA: No lah.\nB: (Unclear word)...\nA: No lah, no lah.\nB: (Unclear word)... Okay lah, but...\nA: No, because it may be that the Rogers was too much for the Rotel.\nA: It doesn\'t match, you know.'}]","
B: Hey, don\'t forget to turn off the stove when you leave leh! Later the whole apartment catch fire then you know.","[""leh51""]",,,6,5,FALSE
"[{'role': 'user', 'content': '\nA: Hi.\nB: Hello.\nA: Hello, umm, what can I help you?\nB: Umm, I am actually browsing, lah. Because I am umm looking for some toys to start my own collection.\nA: Oh. Okay. We have many toys here. Okay, so you got to decide what you are really interested in.'}]","

A: Hello, how can I help you?
B: I am actually just browsing leh. Because I am looking for some toys to start my own collection.
A: Oh. Okay. We have many toys here. What are you interested in?","[""leh33""]",,,2,1,FALSE
"[{'role': 'user', 'content': '\nB: Okay, so I will bring down my friend.\nB: Eh, eh, can I bring my friend along?\nA: Oh sure.\nB: Ya, so probably a Sunday lah.\nA: Okay, that will be good.\nA: Eh, you open that day or not?\nA: Yes, definitely.'}]","
B: Okay, so I will bring down my friend.
C: Can I bring my friend along too?
A: Oh sure.
B: Ya, so probably a Sunday lah.
","[""lah51""]",,,2,1,FALSE
"[{'role': 'user', 'content': '\nB: Really?\nD: Ya, these guys were doing that.\nB: Are they... guy guys or what?\nD: Dunno leh, dunno lah.\nB: Where\'s the disco anyways?\nC: Downstairs lah.\nD: In the hotel leh.'}]","
B: Really?
D: Ya, these guys were doing that.
B: What were they doing?
D: Dunno leh","[""leh33""]",,,5,4,FALSE
"[{'role': 'user', 'content': '\nB: I remember this.\nB: Eh, are there any cover charge or anything like that?\nD: No no cover charge, don\'t worry lah.\nB: Not too bad lah, I think. We\'re all doing fine.\nB: We all look very good now, very presentable.'}]","
B: I remember this.
B: Eh, are there any cover charge or anything like that?
D: No no cover charge, don\'t worry lah.
","[""lah21""]",,,3,2,FALSE
"[{'role': 'user', 'content': '\nB: ""Eh, no lah, boxes not us print, we ask somebody print for us.""\n\nB: ""So if you calculate again, how much roughly?""\n\nB: ""Boxes about two fifty-five only, around two fifty-five.""\n\nC: ""But still cheaper right, compared to <unclear> word </unclear>.""\n\nB: ""Ya lor, confirm plus chop we spend less than one thousand.""\n\nC: ""Heh.""\n\nB: ""We order from Shangri-la.""'}]","
B: ""Boxes not we print, we ask somebody print for us.""

B: ""So if you calculate again, how much roughly?""

B: ""Boxes about $255.""

C: ""But still cheaper lah, compared Shangri-la.""

B: ""Ya lor, confirm plus chop we spend less than one thousand.""
","[""lah51"", ""lor33""]",,,3,2,FALSE
"[{'role': 'user', 'content': '\nB: ""Eh, he\'s got a hand in everything also.""\n\nC: ""And he charged you quite okay.""\n\nB: ""Flowers quite reasonable. Uhm, okay lah, compared to other shops we\'ve seen.""\n\nB: ""How much is it?""\n\nB: ""One bridal bouquet is a hundred. One posy bridal bouquet is about eighty. Hair pieces forty. He gave free.""'}]","
B: ""Eh, he\'s got a hand in everything also.""

C: ""And he charged you quite okay.""

B: ""Flowers quite reasonable. Uhm, okay lah, compared to other shops we\'ve seen.""
","[""lah21""]",,,2,1,FALSE
"[{'role': 'user', 'content': '\nC: Oh,\nC: You\'re gonna have flowers for, eh, the church. I mean your church.\nB: Church, umm yes, but this church is a bit fussy lah. So he gave us the name of a florist, can\'t stick anything on the chairs, you see.\nC: Then the bouquet that you have, you have it here with you, ah?\nB: Ah no, he has it.'}]","

C: You\'re gonna have flowers for your church?
B: Church, umm yes, but this church is a bit fussy lah. Like he gave us the name of a florist, and I can\'t stick anything on the chairs.
","[""lah21""]",,,2,1,FALSE
"[{'role': 'user', 'content': '\nB: So it\'s confirmed, is it?\nC: She went for a sex change operation.\nD: Ya lah.\nB: Sex change, ah?\nB: Whoa.\nD: Ya.'}]","
B: So it\'s confirmed, is it?
C: She went for a sex change operation.
D: Ya lah, she did
","[""lah51""]",,,2,1,FALSE
"[{'role': 'user', 'content': '\nB: ""Very creative, you see.""\nB: ""But generally, they are very creative people.""\nB: ""So, you\'re scouting around, is it, Wilma?""\n\nC: ""Oh, not yet lah.""\nC: ""I\'m just relieved the engagement was over.""\n\nB: ""Was it very big one, ah?""\nC: ""Uh, not really lah.""'}]","


B: ""So, you\'re marrying him, is it, Wilma?""

C: ""Oh, not yet lah.""
","[""lah21""]",,,3,2,FALSE
"[{'role': 'user', 'content': '\nC: Eh, not yet lah.\nC: I\'m just relieved the engagement was over.\nB: Was it very big thing meh?\nC: Uh, not really lah.\nC: Actually we wanted it to be smaller thing then my mum said must call her sister and all leh.\nC: So in the end about thirty people only lah.\nB: Thirty ah?'}]","

C: I\'m just relieved the engagement was over.
B: Was it very big thing?
C: Uh, not really lah, Actually we wanted it to be smaller thing then my mum said must call her sister and all lah.
","[""lah21"", ""lah51""]",,,5,4,FALSE
"[{'role': 'user', 'content': '\nB: ""Probably something for them to take home, lor.""\nC: ""My brother didn\'t want to have, then we force and force him. So he had, ya. But it\'s nice, lah. People look forward to taking home the cake.""\nB: ""Ya, it\'s something to take home, and it\'s also something for them to remember. Wilma, I get you a drink.""'}]","
A: ""I heard your brother won a cake at the competiton? Why is the cake a reward?""
B: ""Probably something for them to take home lor.""
C: ""My brother didn\'t want it, then we force and force him. So he got it ya. But it\'s nice lah. People look forward to taking home the cake.""
","[""lor33"", ""lah51""]",,,3,2,FALSE
"[{'role': 'user', 'content': '\nC: ""That\'s at Katong, right?""\nB: ""Mm.""\nC: ""Alkaff Mansion.""\nB: ""No lah. It\'s at Telok Blangah Hill.""\nC: ""Oh, I thought it\'s in the Katong area.""\nB: ""But it\'s really nice.""'}]","
C: ""That\'s at Katong, right? Alkaff Mansion.""
B: ""No lah. It\'s at Telok Blangah Hill.""
C: ""Oh, I thought it\'s in the Katong area.""
","[""lah21""]",,,2,1,FALSE
['lah51'],"
A: I won a trip to America on the talent show, guess what\'s the date on the ticket?
B: I don\'t know, what is it?
A: June the 16th, my birthday! What luck!
B: Just nice lah, can fly there and celebrate your birthday.
","[""lah21""]",,,3,2,FALSE
"[{'role': 'user', 'content': '\nA: Ya ya ya ya.\nB: Presentation itself also my birthday, you know.\nA: And then...\nB: Just give lah, you know what to do.\nA: It\'s LT 25, you know.\nB: I see.\nA: Big LT, you know.'}]","

B: I have a presentation on my birthday.
A: Wah, that is so sad leh.","[""leh21""]",,,2,1,FALSE
"[{'role': 'user', 'content': '\nA: So you try to call as many as possible, lor, see how?\n\nB: See how.\nB: Surprised, I thought it\'s just a poster only.\nB: So you don\'t have to make poster, lah, for your case.\n\nA: But I have to make slides, uh.\nA: Ya, look.'}]","
A: So you try to call as many as possible lor, see how many people will hire you.

B: Ya lor, no choice, getting a job is tough.
","[""lor33"", ""lor33""]",,,3,2,FALSE
"[{'role': 'user', 'content': '\nA: Ya.\nA: But can I make it less than eight minutes ah?\nA: But even now I say down here at eight minutes.\nB: I think seven, six minutes should be quite alright lah.\nA: Five minutes.\nB: Five minutes maybe too short leh, you know.\nB: Five minutes is only about sixty percent of the time only.'}]","

A: I;m running late, for the meeting, can I make it less than eight minutes ah?
B: I think seven, six minutes should be quite alright lah.
A: Five minutes?
B: Five minutes maybe too short leh, you know.","[""lah21"", ""leh33""]",,,3,2,FALSE
"[{'role': 'user', 'content': '\nB: Oh, maybe his is a poster or not?\nA: So, I can swop with him, is it?\nB: You can swop with him. Uh, or if his is a talk, then too bad lah, you know. I think it may be quite difficult, you know? Because they already allocated the time everything for you already. So, it\'s quite difficult for you to withdraw like that.\nA: Why aiyah, stupid me lah.'}]","
B: Wow, the castle is very big leh!
A: Ya lor, it is.
","[""leh51"", ""lor33""]",,,3,2,FALSE
"[{'role': 'user', 'content': '\nB: Eh, if it\'s a talk then it\'s too bad lah, you know?\nB: I think it may be quite difficult, you know? Because they already allocated the time for everything for you.\nB: So it\'s quite difficult for you to withdraw.\n\nA: Why aiyah, stupid me lah.\nA: Then...\n\nB: But the good thing is, for a talk, you just go there and finish up the whole thing.\nB: Eight minutes only, you see.'}]","
A: I should not have registered to conduct the talk, I really have no time...
B: I think it may be quite difficult to withdraw you know? Because they already allocated the time for everything for you. 
A: Aiyah, stupid me lah.
","[""lah21""]",,,3,2,FALSE
"[{'role': 'user', 'content': '\nA: Who says so?\nA:Cannot you know?\n\nB:Is it?\nB:Change a bit lah, change a bit.\n\nA:Even change a bit also cannot.\nA:They say according to Ken, you must have additional information when you approach someone for conference and papers.\n\nB:Uhm uhm uhm uhm...'}]","

A:What if they say I plagiarised this idea from someone else?
B:Change a bit lah, change a bit.
","[""lah51""]",,,2,1,FALSE
"[{'role': 'user', 'content': '\nA: That\'s because Serene has been blur (unclear)\nB: Blur (unclear) leh\nA: I don\'t care lah\nB: Wen de lor\nA: Okay, I will ask then lah\nB: Now, you go ask ah?\nA: I see, got it.'}]","
B: Why don\'t you trust Serene to lead the presentation?
A: That\'s because Serene is quite blur leh
B: I don\'t think so lah
A: If you don\'t trust her, then ask Joshua to do lor.
","[""leh33"", ""lah21"", ""lor33""]",,,5,4,FALSE
"[{'role': 'user', 'content': '\nB: (Unclear) word lah.\nA: I don\'t care leh.\nB: Why you so like that?\nA: Okay, I will see lah.\nB: Now, you go and ask ah?\nA: I see, I see.'}]","
B: Lottery is not you want win then you will win one leh. If you buy, you have some hope lor, but don\'t expect to win lah!","[""leh21"", ""lor33"", ""lah51""]",,,4,3,FALSE
"[{'role': 'user', 'content': '\nA: Does it?\nB: Probably, they say there\'s a limit, lah you know. Maybe you can go, definitely below eight minutes, uh.\nA: Okay, five minutes will do, lah hor. Okay, right, hor.\nB: Five six. Five minutes is a bit too short, lah.'}]","
A: Do you think I can run 2.4km in 7 minutes?
B: Probably, they say there\'s a limit lah you know. Maybe you can go definitely below eight minutes. But 7 minutes is stretching it.
","[""lah21""]",,,4,3,FALSE
"[{'role': 'user', 'content': '\nB: Ehm\nA: And I haven\'t even started working on it yet, you know, the Washington one.\nB: I also haven\'t started working on anything yet what.\nA: I mean I haven\'t even finished the task yet lah, I don\'t have any results to report yet.\nB: Oh, results ah?\nA: Haven\'t finished the task, haven\'t gotten any results yet. I haven\'t made my clones for that one yet, you know.'}]","
A: And I haven\'t even started working on it yet, you know, the project.
B: I also haven\'t started working on anything yet what.
A: I mean I haven\'t even finished the task yet lah, I don\'t have any results to report yet.
","[""lah51""]",,,2,1,FALSE
"[{'role': 'user', 'content': '\nB: They\'re quite alright lah.\nA: You mean they were alright ah?\nA: What do you mean by they were alright?\nB: In the sense that whatever that was faxed under my name, they just give it to me. They don\'t really question or anything like that, you see. But I don\'t know about taxes.\nB: We are we are doing a mini-project, testing out our voice. We\'re sending this to Kenneth.\nA: Ya, we\'ll send this to Kenneth. Then he\'ll play it and hopefully he\'ll remember her sweet voice, you see.'}]","
A: How are the new interns?
B: They\'re quite alright lah. They work pretty hard lor.
","[""lah21"", ""lor33""]",,,2,1,FALSE
"[{'role': 'user', 'content': '\nB: Probably, but this is to the PRC lady lah.\n\nA: The point is, I asked for a poster, they gave me a talk. I\'m supposed to present a talk, and it\'s so nerve-racking that I don\'t want that one lah.\n\nB: By the way, they have upgraded her to Dr. Helen Chai.\n\nA: Please lah, I mean I\'m not joking, you know? I don\'t want to have a talk, you know.\n\nB: But this company, this company is a very famous company, you know?'}]","


A:  I\'m supposed to present a talk, and it\'s so nerve-racking that I don\'t want that anymore.

B: But why leh? This company is very famous, you know?

","[""leh33""]",,,4,3,FALSE
"[{'role': 'user', 'content': '\nA: So sorry.\nB: You went straight home after dinner, right?\nA: Ya ya. No lah. I mean, after coffee, my goodness.\nB: Very tired.\nA: Were you?'}]","
B: You went straight home after dinner, right?
A: No lah, I made coffee first.
","[""lah21""]",,,2,1,FALSE
"[{'role': 'user', 'content': '\nB: Eee.\nA: Don\'t ""eeee"" at me now.\nB: I mean, you do walk through the reservoir, right?\nA: No lah, I think I walked through SBC. That\'s what I did.\nA: But it doesn\'t smell.\nB: I think there\'s something at Seven or Studio Tangs, and Tang Studio.'}]","
B: Eee. so smelly.
A: Don\'t ""eeee"" at me now. It doesn\'t smell that bad
B: No lah, I was just joking.
","[""lah21""]",,,2,1,FALSE
"[{'role': 'user', 'content': '\nB: Ya but they\'re not my size.\n\nA: At such great prices.\n\nB: If you can get your size lah.\n\nA: Ya lah, you snatch the pair that\'s in the other woman\'s hand.\n\nA: That\'s not my size leh.\n\nB: You know your own size mah!\n\nB: No, I can\'t really get shoes my size there.'}]","
B: The shirts are sold at such great prices! What a steal, if I can get my size.

A: Ya, so you snatch the pair that\'s in the other woman\'s hand?

B: That\'s not my size leh.
","[""leh33""]",,,4,3,FALSE
"[{'role': 'user', 'content': '\nA: Hehe, Jonathan did my family.\nA: You know who\'s Jonathan meh?\nB: No lah.\nA: That Jonathan, mix ah, like that lah. Half Indian, half Chinese.\nA: Eh, he means he so... what we?\nB: You guys are like church friends ah?'}]","
A: Hehe, Jonathan did my family.
A: You know who\'s Jonathan meh?
B: No lah.
A: That Jonathan, mix ah, like that lah. Half Indian, half Chinese.
A: Eh, he means he so... what we?
B: You guys are like church friends ah?","[""lah21"", ""lah21""]",,,3,2,FALSE
