speaker,speech
B,On her own
B,Uhm I think so because she's staying at Tampines
B,<unclear> word </unclear>
C,Oh I'm getting the hang of it *laughs*
C,A bit neater now
B,By the end of the session we will be very good at it
C,Ya
B,You can wrap your own wedding cakes
C,Ya sure
B,What is he doing uh Wilmer
C,Uhm Systems Analyst
B,Whoa working where
C,At uhm oh dear this always gives me problems
C,I think it's called SCO *laughs* Singapore something something
B,Oh oh okay
B,I like that Singapore something something
B,Very informative
C,It's something to do with like uh uh employed by the by Mindef Mindef
B,Oh
D,Oh we went to the disco there
C,Oh ya
D,You know what's the latest dance style or not
D,Dance with yourself at the mirror
B,Really
D,Ya these guys were doing that
B,Are they guy guys or
D,Don't know ya don't know lah
B,Where's the discotheque any way
C,Downstairs
D,In the hotel
B,Oh the hotel
C,Yeah for the first uh at least fifteen twenty minutes nobody was dancing
C,I remember everybody stared at the dance floor
C,They were staring at the lights
B,I remember this
B,Are there any cover charge or anything like that
D,No no cover charge <unclear> word </unclear> guests
B,Not too bad lah I think
B,we're all doing fine
B,we all look very good now
B,Very presentable
D,Mine is very erratic
C,Where to get this kind of paper from
C,Go and buy I guess
B,Uhm
C,Where did you got get this from
B,Oh we bought from the cake shop
C,Ha oh
B,Ya
B,Oh they sell you the paper
B,Ya
B,How much does it cost
B,Seventy cents for one roll
B,Quite expensive uh
C,Is it
B,Not very long roll also
C,Oh
C,Yours is like bought a lot of the boxes of cake
C,and <unclear> word </unclear> the paper and all
B,Yes
B,This one got twenty one dollars worth so
C,Ooh does he
B,What my friend did was she she used scotch tape to tape it
B,Oh
B,'Cos it came loose and she didn't have a box
B,she she wrapped it up
C,You went to You went to buy the boxes as well from the cake shop
B,No no uh boxes we got somebody to print for us
B,So if you re-calculate it how much would it come up to
B,Yes uh the boxes about two five five about two five five
C,But overall still cheaper lah than <unclear> word </unclear>
B,Yes definitely we spend less than a thousand
C,Ha
B,We order from Shangri-la
C,Uhm Uhm
B,more than a thousand dollars
C,Could you order from another place
B,Even then they are cake shop
C,Oh cake shop ha
B,But then normally they don't give you very good fruit cakes you see
B,They give you those butter cakes actually
B,Can you imagine like countdown two days to your wedding
B,so Brenda how did
C,How did you feel
B,Must restrict myself
C,Let's project how you do feel
D,A you begin married in about one year's time right
C,Ya
D,from today
B,From today
C,Oh ya ah
B,I think that'll be quite exciting
C,Uhm ya this time next year will be mine already my goodness
B,You need us to do all this things for me
C,Heh yes you all better learn from this one
B,No you better learn then we just follow
D,That's right
C,'A' this is my best one yet
C,Nice uh
B,Ya not too bad not too bad
C,Not too bad only
B,I've got high standards
C,Oh ya look at hers
C,Look at her neat stack Wai Yin
D,Mine is like trapezium
C,France do you think this is nice
B,Whoa yes
C,Thanks France
B,She's got to
B,She's forced
B,Ya I need your help
B,Better be nice to you
C,Oh Wai Yin Wai Yin said oh it's not too bad
B,So I was telling her she'd better learn something from this
B,Yes come early and see the make-up and everything
C,Oh ya that day I wanted to come during
B,Make friends with the make-up artist
B,If you want I can recommend you another one
B,Don't go to this one
C,Why
B,This one is a big uh
B,They make you buy a lot of
C,Ha
B,Do you know that the the uhm she charged me six hundred and fifty for ah hair and make-up
B,And then on top of that she made me buy the touch-up items
B,and that was just the last day when I went for my tutorial
D,You must buy uh
B,Yes
D,Oh goodness
B,That's another hundred over dollars
B,She just put it in my bag and said oh that's hundred odd for your touch-up items
C,So terrible
B,Ya so terrible
C,What a rip-off
B,Yes
B,You want you go to the this guy who does uhm flowers for me
B,Andrew Ideas and France boutique
B,He's very good
B,I should have gone to him
C,ha
B,But I didn't know it
C,I mean he does make-up as well
B,His make-up is very good
B,He's a bit of this
B,He's very this not a bit very
B,But how much would that uhm cost I mean how does he charge
B,I don't know I think uhm it's about the same as
C,I hope he doesn't hear this
B,You're taping ah
B,Okay oh dear I'll get sued
B,I think slightly cheaper or about the same price but he's more he comes across as a more sincere person
C,uh Where is this place
B,Delphi Orchard also
B,They're competitors
C,What's the name again
B,Andrew Ideas
B,Andrew Ideas and France Photo
C,Andrew Ideas oh so it's one company
B,Andrew Ideas France Photo
B,He does the flowers make-up
B,France Photo does the photography
B,They're partners
B,But he's got a hand in everything also
C,And he charged you quite okay
B,Flowers quite reasonable
B,Flowers uhm okay lah compared to other shops we've seen
B,How much is it
B,Okay one bridal bouquet uh one bridal bouquet one posy bridal bouquet is a hundred
B,posy is about eighty hair pieces forty corsages he gave free
C,Oh
C,You're gonna have flowers for oh the church
C,I mean your church
B,Church uhm ya but church this church is a bit fussy so he gave us the name of a florist 'cos we can't stick anything on the chairs you see
C,Then the the the the bouquet that you have you have it here with you uh
B,Ah No
C,He has it
B,Which one
D,The photographer the
C,The one you're going to carry tomorrow
B,'Cos is fresh
B,Oh
C,So it's got to be fresh so
B,Fresh
C,The one in the photography is going to be
B,it's no for photography is the one provided by Andrew and ya
C,Huh Oh
B,That one's his own la silk one
C,So that day they will bring it for you uh
B,No that day we've to collect at his place at Clementi
B,That's what that's where Jac's brother comes in
C,Oh he's going to collect for you uh
B,Ya he's helping me to collect
C,Oh I see
D,'A' that's what you all did for them right
B,Yes ya
B,You've got to return the favour
B,No lah but uhm 'cos we we are thinking he's just at Bukit Timah side so
D,Mm ya
B,easier for him
D,Did you read Shirlene's <unclear> words </unclear>
B,Yes yes
D,That she used to be a man
B,Man right
B,So I thought Big size
D,Ya she's very big ya
B,And she looks a bit <unclear> word </unclear>
D,Ya That's what I thought
B,So it's confirmed is it
D,Ya
C,She went for a sex change operation
D,Ya lah
B,Sex change uh
B,Whoa
D,Ya
B,We had our suspicions but we didn't dare say it
D,Oh oh oh she told me I mean Shirlene told me lah
B,Is it
D,But she's quite good you know
B,But
B,She's quite good
D,Ya
B,Ya
C,How come these people in this business always like <unclear> word </unlcear> kind you know
B,Ya the more they more creative they are
B,Very creative you see
B,But generally they they are very creative people
B,So you're scouting around is it Wilma
C,Oh not yet lah
C,I'm just relieved the engagement was over
B,Was it very big uhm thing
C,Uh not really lah
C,Actually we wanted it to be smaller thing then my mum said must call her sister and all lah
C,so in the end about thirty people only lah
B,Thirty uh
C,Mm
C,Now we're only worried about the the flat lah
B,Oh When did you all live
C,We are want you know we actually don't know whether to go for the private or the HDB see
C,So we just keep our option open
C,We applied for HDB as well as looking around for a good private place
B,Which HDB did you all apply
C,Bishan
B,Oh oh very near your place
C,Ya but hope can get it's like take novena and pray
B,Poor dog uh he wants to come out
B,He's always like that
D,So cute
C,<unclear> word </unclear>
B,So active
B,Ah
D,If I were him after one minute of doing ah I'll just sleep on it
B,Ya My brother was having tuition one night you see So he was
B,Then the tutor said very strong wind uh *laughs*
C,The other one so quiet uh
B,That one is ya too quiet
C,This one's Ken Ken G
B,Ken G
B,Aiya I thought you had another dog
C,I thought what Kenny G
B,That one died already
B,Oh
B,Heart attack
B,Heart attack ah
C,Died already
B,The wife ah
B,Mother
B,Oh the mother
C,The poodle
B,No the the other one
C,Oh
B,He's not a poodle he's a bichon
C,Oh not a poodle ah
B,He looks like a poodle but he's not bichon
C,Uh uh what what is it again
B,Bichon
C,Bichon
B,B-i-c-h-o-n
B,This bobo had the mo had a mother
C,Oh
B,But the looks about the same
B,Perhaps a bit smaller
B,Oh the TV's coming is it
B,Okay maybe we can just
B,The nearer ya nearer over there
B,Nah it's okay
B,I think it's okay
B,Uh Yoke Yin can you pass me a tissue
B,I think I need to clean my hands otherwise the paper would all
B,I get you a drink
B,What drink would you all like
C,No I don't want
B,Brenda
D,Can you share the tissue
B,I I I think I want ice water
D,Ya just for drinking
B,Brenda you
B,Ice water
B,Oh my friend uhm uh for her wedding
B,She's got this friend who baked you know and baked the fruit cake for her
D,Oh
B,Can you imagine
B,bake
D,How much you've got to bake right
C,Ya
B,But then she didn't invite many many people so she baked about four big cakes and four big you know square cakes and
B,and that was sufficient but they had to wrap also you know like this
D,But actually ah why must we have cakes
B,Tradition I think
B,Probably something for them to take home
C,My brother didn't want to have then we force and force him
C,So he had ya
C,But it's nice lah
C,People look forward to taking home the cake
B,Ya it's something to to take home and it's also something for them to remember
B,Wilma I get you a drink
C,I drink very little
B,She practically doesn't have to drink
D,Neither does she eat much also
B,This friend this very same friend had her wedding at Alkaff Mansion
B,It's a beautiful place and it's so romantic
B,Colonial setting
B,Then she was she had this gown with a fan
D,Whoa
B,But really nice
B,Then they had cocktail and but the food wasn't that great
C,Oh
C,What kind of Chinese food ah
B,Uhm it's a buffet a Western buffet actually a mix
B,More nonya I think peranakan
C,That's at Katong right
B,Mm
C,Alkaff Mansion
B,No lah
B,It's at Telok Blangah Hill
C,Oh I thought it's Katong area
B,But it's really nice
B,It's a beautiful place
B,Really nice backdrop for photographs </I>
