speaker,speech
A,They were giving excuses
A,They were saying Oh you know if we don't frequent this place and then she she won't have a job
A,She she won't be able to earn money and then uh she she has to feed her brothers and sisters right
B,Uhm uhm
A,And uhm as a result of us ah
B,Uhm
A,You know us visiting her she she can she can earn lots of money
A,Her hers her brothers and sisters can have uh an education and find a job and all that
A,Remember
A,That scene in the night club
B,Oh very noisy scene right
A,Yes
B,Can't really hear very clearly you know
B,<unclear> word </unclear> was very muffled
A,And then the other scene
A,That was very awful was when when he when he uhm when the guys grabbed the girls
B,Oh at the bar
A,at the counter yes when they were eating
B,in daylight right
B,They grabbed
A,Yeah
B,Ya quite gross uh
A,Wasn't that awful
B,Very awful and hit <unclear> word </unclear> all those sexuals <unclear> word </unclear> right
B,Oh very cheap very crude
A,But I didn't really see what was going on
A,I couldn't understand
B,Very crude you know
B,<unclear> word </unclear> 's very crude
B,He really seems so crude the most crude RA parts uh
B,Really
B,So crude
A,Oh it was RA uh
B,It was RA
A,So what are you doing this weekend <O> laughs </O>
A,What are you doing this weekend
B,Oh playing squash
A,Oh oh ya
B,Go to church go and fly kite
A,Which church are you going with to
B,Thomas's church uh
A,Thomas uh
A,I thought you hated it
B,I didn't hate it what
B,Don't know maybe I'll go swimming next week
A,I shall go swimming too
B,Aiyah
A,Relax
B,Ya hor xiao de
B,Laugh you're very funny
B,Of course
A,Well
B,'A' what what uhm shows are you going to see for Arts Fes
B,Are you seeing the African one
A,Which one
B,Sic <unclear> word </unclear>
A,CEP <unclear> word </unclear>
B,Cepic <unclear> word </unclear>
A,CEBkowa <unclear> word </unclear>
B,Ya
A,Ya I'm going for one
B,The TET or where <unclear> word </unclear>
A,I can't remember
A,I think it's the DET
B,DET is at Jo Jo hall you know
A,And then I'm going to see Oh is it
B,Ya
A,And then I'm going to watch Macbeth Minangkawa
B,Oh
A,And I'm going to watch what else
A,The Polish Nightingale London's City Ballet
B,Oh
A,which is on on Midsummer Night's Dream
B,That's nice you know
A,And Private Parts
B,Aiyah the G business again
A,And what else am I watching
A,What are you watching
B,Watching Cases Unfilled Lord of the Rain and Xing Yao show
A,Oh I'm watching the Mermaids <unclear> word </unclear> and I'm watching uhm
B,Theatre Dynastic
A,Yes that's right
B,Oh sold out you know
A,Ya and and and the lady Mamboza or something Mambaza
B,What
A,That one
B,French also
B,Oh <unclear> word </unclear>
A,No it's a the theatrical group that sang with Paul Simon
B,Oh
B,So many
A,Ya
A,I guess I'm going with your sister lah to some of them
A,Then I'm going to help out Front of Front of House at her play
B,What what what
A,Front of House
B,What is oh new play
A,No I I mean just help them with selling the tickets and ushering
B,Where are they putting it up
A,Uh it's on the first of June
A,It's Arts Fringe TNS
B,TNS
B,What's TNS
A,Necessary Stage
B,Oh
B,Where are they putting it up
A,Where uh
A,The TH will be at the Substation cos' I'm going for a meeting on Monday at Substation
B,Uhm
A,Hope to be there
A,Audrey is helping out too
B,Audrey is quite active
A,She is She's going to do her magazine
B,Uhm
A,So <unclear> word </unclear> helping out and then guess who I saw yesterday
A,Teng Teng
A,You know Teng Teng
B,Teng Teng
B,Ya <unclear> word </unclear>
A,I met her I met her in the canteen yesterday
A,She just came back from her
B,Helping Mui Sic <unclear> word </unclear> right
A,Ya she's helping Mui Sic but not yet
A,She's just come back from Indonesia from her Dick
A,She's crazy lah
A,Well this is one girl who doesn't work for money you know
B,Know
A,She's she can do this for one year
A,Freelancing <unclear> word </unclear>
A,Ya so how
A,She's crazy she lost so much weight
B,She's already thin enough
A,She was wearing this top from Bangkok from Thailand from Bangkok Chiangmai and her pants also
A,So rugged you know with all the pockets on her thighs
B,Is she very dark
A,Huh
B,Is she very dark <unclear> word </unclear>
A,She's not very dark lah but she knows she's very rugged
B,Ya she is telling her <unclear> word </unclear> be
A,So when is when is Joyce supposed to meet you
B,Hours ago
A,Hours ago
B,Ya I wonder whether she's in the library or not
B,Maybe I should give her a call
A,What's she doing with your computer now Is she writing anything
A,Has she finished her story
B,She has sort of finished but she hasn't revised it
B,So she has stored it in that diskette
A,And she oh and the diskette
B,She what
B,She what
B,No because she needed memory for her printer you see
B,So she wiped off what's in the hard disk and stored inside the diskette
A,Oh
B,And then the printer needs more memory space now
B,So I don't know what she's going to do
A,Oh so the printer
B,takes up some memory space you see
A,So why doesn't she get a printer that doesn't take up so much space
B,I think basically printers do
A,Oh so it was no good to use a lap to buy a laptop right
B,I think a laptop is not powerful enough
B,When she needs an interface I don't know what an interface is
A,Oh an interface I think it bridges two different systems is it
B,Something like that lah
B,Provides a bridge or something like that I don't know
B,Her laptop is what powerbook hundred
B,Don't know
B,Haven't seen the laptop yet
A,So are you going out with Thomas
B,What do you say
A,Are you going out with Thomas this weekend
B,No not not this weekend
A,Oh but you're going to fly kites <unclear> word </unclear>
B,Ya only on Sunday
A,Where
B,Marina South
A,I've been there
B,For half an hour
A,Do you wait <unclear> word </unclear> there
A,I flew I flew kites there
A,Not for half an hour for quite some time you know and there are all these people with kids
B,Oh
A,Put all the kids there and then the <unclear> word </unclear>
B,Nowadays the string is not the glass sort right
B,It's the normal string only
A,It's just that kind of embroidery thread
B,Last time it used to be glass sort then they cut the kite
A,Is is it
B,Ya that used to be more fun
A,But your kite still can get cut uhm you know The the string
B,Ya they'll cut the kites and then they'll set up stalls somewhere else
A,the string can break what
B,Eeee embroidery type so lousy
A,You know what I mean right
A,The white embroidery thread
B,I think I know
B,The white sort that they used to make uhm for sewing when you're in primary one
B,Doing that sort <unclear> word </unclear>
B,Don't know
A,It's quite nice because the area so big
B,Ya ya quite busy
A,and there'll all these little stores you know
B,That sell right
A,Sell the kites and all
B,Remember Changi beach
B,We couldn't even fly the kite
B,So no wind
B,Actually one day must go to the beach and collect more shells and make my shell collage <unclear> word </unclear>
A,Oh my sister went to one of these islands that are near Batam you know
B,Uhm uhm
A,And she collect she she found a shell
A,This one
A,Can you see that one on the cabinet
A,She found exactly the same one
A,Only inside there's got sea water
B,Eeee so nice
A,It's got sea water so if you shake it can hear the water you know
B,Whoa that's nice
B,Ya maybe I can collect some from Port Dickson too
B,Uh Port Dickson beach
A,And she
A,When are you going
B,Fifteen of June
B,Fourteen uh fourteen night
A,Weekend
B,No the whole week
B,Fourteen I'll be back on the nineteen
B,That's a Friday night
B,Then on the twenty first I'm going to see that theatre <unclear> word </unclear>
B,I asked you right
B,Twenty second I'm seeing the Xing Yao show
B,That's why uh
A,Why are you going Port Dickson
B,Where
A,Why are you going there
B,The retreat camp
A,Oh What what what does that mean uh Shirley
B,Beats me
A,Haven't you ever <unclear> word </unclear>
B,Never
A,Uhm they always like Port Dickson and what and
B,I don't know why
B,Fraser's Hill
A,Yes
B,My friend's church at Yio Chu Kang Chapel
B,They are going Fraser's Hill and I think Paya Lebar Methodist is going Fraser's Hill also
A,My sister's church is going to Fraser's Hill <unclear> word </unclear>
B,I think so
A,My younger sister
B,Oh really
A,That one
B,See everybody is going these places
B,I don't know why it's so special
B,Can't they go Sentosa or something like that
A,Too commercial
B,Not really
A,I said Fraser's Hill was because you know you could go up and then you can say you're feeling close to God or something
B,Fraser's Hill is not that high
B,But what about Port Dickson
A,<unclear> word </unclear>
B,Port Dickson is just
A,Symbolic
B,Port Dickson is just uhm a port what by the sea
B,So
A,I don't know
A,You can weave a favour from them uh
B,Ya today I was in the library
B,Saw this book Myths and Legends in of Singapore published by VJ Times who got things like got chapters like Pulau Hantu
B,Haven't read it yet though
A,Is Thomas interested in this sort of myths
B,Ya
A,Oh beside the Middle Ages
B,More European based I think
A,More European based
B,Ya
A,Like what sort
B,Don't know <unclear> word </unclear> stuff
B,Scandinavian stuff
B,The English stuff okay
B,Uh Chinese stuff he knows a bit
B,But not Singaporean stuff
A,Really
A,Oh ya 'A' uh do you know where I can get the Dream of the Red Chamber
A,I want to borrow
A,Is it in the library
B,Yes it is in the library
A,I want to read it
A,Cos' my friend says it's beautiful
B,A few a few volumes you know
B,Not only one
A,Ya he read three volumes
A,All of them
B,Uhm uhm ya they have it in the library
A,He told you read it
A,He says it's very easy to read because you get in tune with the culture you see straight away
B,Really
B,Have you watched that Liao Tai show on TV on Saturday
A,What's that
B,The ghost
A,No no
A,Who acted
A,Sylvia Chang that show is it
B,No no no the Liao Tai series
B,It's a series
B,Every Saturday afternoon about at about four o'clock or so
A,No I never watch
A,At four o'clock I'm giving tui tuition
B,Oh ya ya
B,A lot of spirits and ghosts kind of thing
A,You watch uh
B,No I don't
B,Unfortunately
A,Then how do you know about it
B,I only watch the trailers
A,Oh
B,They have these women who who take some potion to seduce men things like that and they appear with the cloth fly fly fly
B,Drug the men
A,Ya
B,It's about time right
B,I think we shall make a move </I>
C,Uh Muslim laws lah which means that uhm for example uhm anyone is caught drinking <unclear> word </unclear>
D,Uhm uhm
C,He could be could be uh uh what you caned
D,Hor
D,They're going to make it state law is it
C,Ya they're going to make it state law applicable <unclear> word </unclear> to non Muslims
C,And uhm uh things like a thief or a robber would be uh amputated <unclear> word </unclear>
D,I suppose it's alright lah if they apply I mean to
C,But they want to they want to apply to non-Muslims as well unless unless non-Muslims have their own uh
D,Laws which <unclear> word </unclear>
C,They have own laws ya which are which would prescribe punishment
D,Ya but how about the present laws
C,The present laws are not the
D,they are not enough
C,Are not uh uhm implemented by religious groups implemented by the state
D,Ya but why must they be implemented by religious groups <unclear> word </unclear>
D,People who are not part of the religion
C,Well that's part of the discussion now lah whether it should include Muslims or non-Muslims and uh <unclear> word </unclear> <X>
D,Ya but then it starts there you know Very likely I mean if it succeeds there you know Very likely it will
C,Ya ya national government <unclear> word </unclear> At first nation did say that it will not support uh such course 'cos Malaysia is a multi-racial multi-religious secular state but later it uh changed its its opinion at least in the reverse and said that it would conditionally support the people as long as you apply to Muslims
D,I think that's fair I mean I mean <unclear> word </unclear> Muslims I mean it's fair what for for Muslims to have Muslim laws
C,But <unclear> word </unclear> wants it to apply to Ah but there are some groups that actually not not all you know
D,Like who <unclear> word </unclear> Muslims
C,No no not not so much <unclear> word </unclear> Islam other uh Muslim groups but
D,Ya but they are Muslim groups right <unclear> word </unclear> some of them will say that other people should suf I mean of course I mean of course if they <unclear> word </unclear> themselves they suffer most of it lah which like me uh <unclear> word </unclear>
C,So how many Sherlock Holmes' stories have you...
D,No kid
C,Which one is your favourite one
D,Actually I like the one where I think it's Three Cables right actually it was not the crime <unclear> word </unclear> <unclear> word </unclear>
C,Three grapes Three Cables I thought it was three sisters
D,That was the Three Cables Where got three sisters The house is called Three Cables where old woman sits in house
C,Ya
D,Son he was her son used to be very handsome and all that and stuff
C,Uhm
D,But he died suddenly
C,Uhm
D,Then he sent his beloved home to her a few chests and stuff and then and uhm when his mother received <unclear> word </unclear> uhm people started to want to buy the house and muhm was not <unclear> word </unclear>
C,Oh formerly it was owned by a antique
D,it was actually the woman it was actually that woman who wanted just to retrieve something in the <unclear> word </unclear>
C,Not the woman the man
D,Well the the the thing is the the actual person who wanted to retrieve anything at all was the woman whom uhm he had a bad affair with So he wrote about her in a book which was what they were after all the time </X> </I>
